Comment Text,Comment Score,Parent Comment ID,Comment Depth,Created Timestamp
"You don't have to look at what triggered the event, but at the whole history of the country. The fact that the public transports there can run over people without any consequence -- which is already fucked up by itself -- is probably only one amongst many other issues they face.

A couple years ago a bunch of protests happened in Brazil against the Government's corruption and bad admnistration and what triggered the event was a raise of 20 cents in the bus money. Some people tried to demoralize the cause by saying things like ""it's just 20 cents"", but that overly simplistic explanation didn't take into account that it was like the 3rd ""small"" raise in a very short amount of time and that there were a lot of recent cases of corruption in all sectors. It wasn't only about 20 cents, but it was what triggered the event. Nowadays Brazil is much better and a lot of important politics were sent to the jail for corruption, including the highly popular ex-president.

I mean if you're irritated because people in the other side of the world who have no direct impact in your life are protesting for a better life then just imagine how pissed you would be if bus drivers would hit and run the people you knew and there were no consequences for that.",18,t1_e3nknco,1,1533492130.0
"While I suspect that you are trolling, here is basically what happened as far as i understand

1) Bus accidents happen all the time in Bangladesh. The day before, a bus crashed and 33 people were killed. It's not safe at all.

2) This time bus drivers were racing to get more passengers and in the process hit 15 people, killing 2 students. Those drivers went free without punishment.

3) People protest in demand for more strict traffic laws.

4) Minister in charge of transportation with known ties to POWERFUL CORRUPT TRANSPORT UNIONS makes insensitive remarks and brushes off the issue despite massive protest.

5) Public demands for his resignation.

6) Police start shooting rubber bullets and armed gangs show up beating and sometimes even murdering students with machetes.

As far as I have seen, all news outlets agree that the protests were peaceful until the moment that the police started shooting.

Edit: rubber bullets",17,t1_e3nknco,1,1533498906.0
"It's okay bro, help your own country out first as I can assure you we will be fine. It's not the first time after all.",8,t1_e3ox6va,1,1533546368.0
I hope your day is as pleasant as you are. ,7,t1_e3ox6va,1,1533579200.0
Wow! It's pretty sad that at a time of crisis you'd rather spread pathetic opinions and divide us further than help people. Says tons more about you than the kids fighting for what's right. I hope you find it in your heart to be more kind and human. Good luck.,6,t1_e3ox6va,1,1533577901.0
Lol Pakistan is a train wreck. ,4,t1_e3ox6va,1,1533564055.0
I read in the news dozens of people died on the election day in Pakistan?? Is that a good democracy?,6,t1_e3ox6va,1,1533552499.0
"Fingers crossed. With the language barrier and limited internet access, I don't expect to make a difference (except perhaps [here](https://old.reddit.com/r/privacy/comments/94kxbi/trying_to_bypass_government_surveillance/) - I hope we hear more from them), but it's the step I *could* take...",4,t1_e3mjxnv,2,1533439407.0
We've been mailing them for quite a while now. No response sadly. We might get some by tomorrow.,21,t1_e3lcpx5,2,1533393766.0
thank you!,5,t1_e3m5vqk,2,1533420671.0
"from Medium

[https://medium.com/@skbshinigam/student-massacre-in-bangladesh-3cbb75fdbda4](https://medium.com/@skbshinigam/student-massacre-in-bangladesh-3cbb75fdbda4)",2,t1_e3m5vqk,2,1533441908.0
check live reddit thread for translation https://www.reddit.com/live/11e4mknpbhjqr,10,t1_e3m4drn,2,1533419099.0
"Also don't use SMS , they can use their capability to intercept 2FA codes. Use Authenticator apps.",8,t1_e3n1o5w,2,1533464070.0
"You can use either LastPass or BitWarden without worry to generate and store your super complex passwords. BitWarden especially uses an open source algo, thus it's security is maintained by worldwide contributors.",6,t1_e3n1o5w,2,1533462914.0
"There was another video where a brother was crying for his sister. These videos really breaks my heart. 

The people who are claiming that these are rumors are obviously *League er Polapain* or blind follower of AL. They've done the same in the past and it basically is their strategy. I don't know how much blind and dumb can one be.",5,t1_e3mk5kh,2,1533437323.0
Most likely it was taken down from facebook.,1,t1_e3q7e0r,2,1533607748.0
[this is using the fb lite app](https://i.imgur.com/yjgJoOC.jpg),15,t1_e3llumb,2,1533403190.0
Facebook has been disabled access via the Mobile data. They are blocking this at gateway level.,3,t1_e3lm6w4,2,1533462289.0
I will DM to them if you wish.,7,t1_e3macmq,2,1533425356.0
[deleted],1,t1_e3macmq,2,1533433450.0
"Thanks for writing to the newspaper. But nope, I don't see anything. rsi.ch/news is the most prominent for world news but can't see anything about this. They may talk about it on the TV or radio.",2,t1_e3n2pqb,2,1533465791.0
"no it did. https://imgur.com/a/ipspEDO

also fb is removing content as well - https://imgur.com/a/U4p2MXy",11,t1_e3lo5dc,2,1533403172.0
"I just did a Google search on Bangladesh and literally only Al Jazeera is giving it the deserved coverage, all the other major new sources are not covering it it all or the headings are not painting the incidents in the right light I feel so upset 

Edit: ok I did find an article on [NYT](https://www.google.com.sg/amp/s/www.nytimes.com/2018/08/05/world/asia/bangladesh-students-protests.amp.html) that reads rather fair. ",10,t1_e3osz3f,2,1533537607.0
"Here's a collection of some of the latest videos: 

https://www.youtube.com/channel/UC3Pw6X2IoPWKWrNNnQ66_Lg",3,t1_e3mzifo,2,1533458196.0
">CL are attempting to break down a gate in order to light fire to a building sheltering protesters. Location: Dhanmondi

>I just want this to end. /u/VPM43

This was sent out 13 minutes ago. Video released so far indicates that burning people alive might actually be happening. Sick to my stomach. ",10,t1_e3n0jzj,2,1533460585.0
"dude, don't be dishearten. we did not have cellular data service in 52, 69 or even 71. we still pulled through and justice will Insha Allah prevail. world is watching and hasina administration must answer to Bangladeshi citizens sooner than later. ",3,t1_e3n0q9b,2,1533464910.0
Trying to bury everything....,7,t1_e3o3tox,2,1533507829.0
"**14. Injured Student.**

*LINK:*

[http://13.58.156.176/Cloud%20folder%20backups/Students%20get%20attacked%20by%20chatro%20league/video-1533389241.mp4](http://13.58.156.176/Cloud%20folder%20backups/Students%20get%20attacked%20by%20chatro%20league/video-1533389241.mp4)

**15. Image of dead woman.**

*LINK:* [https://drive.google.com/file/d/1w1TIEM2WpIU5nHOafRIFmac2D64tW6WX/view](https://drive.google.com/file/d/1w1TIEM2WpIU5nHOafRIFmac2D64tW6WX/view)

**16. Information Ministry warning Ekattor TV to stop coverage.**

*LINK:* [https://www.thedailystar.net/backpage/ministry-warns-ekattor-tv-its-coverage-of-student-protests-for-safe-roads-in-bangladesh-1616194](https://www.thedailystar.net/backpage/ministry-warns-ekattor-tv-its-coverage-of-student-protests-for-safe-roads-in-bangladesh-1616194)

**17. General Secretary Obaidul Quader warns students of foul play in student's campaign.**

*LINK:* [https://bdnews24.com/politics/2018/08/04/obaidul-quader-warns-students-of-political-foul-play-in-non-political-campaign](https://bdnews24.com/politics/2018/08/04/obaidul-quader-warns-students-of-political-foul-play-in-non-political-campaign)

**18. Internet has been slowed drastically and/or shutoff in select areas of Bangladesh.**

*LINK:* [https://www.thedailystar.net/country/bangladesh-mobile-internet-speed-brought-down-across-for-24hrs-1615909](https://www.thedailystar.net/country/bangladesh-mobile-internet-speed-brought-down-across-for-24hrs-1615909)

*LINK:* [https://www.straitstimes.com/asia/south-asia/bangladesh-shuts-down-mobile-internet-to-tackle-teen-protests](https://www.straitstimes.com/asia/south-asia/bangladesh-shuts-down-mobile-internet-to-tackle-teen-protests)

*LINK TO BANGLADESH TELECOMMUNICATION REGULATORY COMMISION CLAIMING INTERNET ISSUES ARE DUE TO “TECHNICAL ISSUES”:* [https://bdnews24.com/bangladesh/2018/08/05/technical-issues-slowed-mobile-internet-says-btrc](https://bdnews24.com/bangladesh/2018/08/05/technical-issues-slowed-mobile-internet-says-btrc)

**19. Prime Minister claims Road Transport Act, which contains all the demands being made from protesters, will get approval from cabinet on Monday, 8/6/18.**

*LINK TO ARTICLE:* [https://www.dhakatribune.com/bangladesh/government-affairs/2018/08/05/quader-nine-point-demands-to-be-fulfilled-after-new-law-passes](https://www.dhakatribune.com/bangladesh/government-affairs/2018/08/05/quader-nine-point-demands-to-be-fulfilled-after-new-law-passes)

**20. US Ambassador Convoy Attacked**

*LINK TO ARTICLE:* [https://www.msn.com/en-us/news/world/us-ambassadors-convoy-attacked-by-armed-men/ar-BBLw0ir?ocid=spartanntp](https://www.msn.com/en-us/news/world/us-ambassadors-convoy-attacked-by-armed-men/ar-BBLw0ir?ocid=spartanntp)

**21. Photographer Shahidul Alam picked up by Dhaka Metropolitan Police (by force it seems) after interviewing with Al Jazeera.**

*LINK TO INTERVIEW VIDEO:* [https://www.youtube.com/watch?v=J9j3EgLm62Q&feature=youtu.be](https://www.youtube.com/watch?v=J9j3EgLm62Q&feature=youtu.be)

*LINK TO ARTICLE CLAIMING ABDUCTION:* [https://www.dhakatribune.com/bangladesh/dhaka/2018/08/05/photographer-shahidul-alam-picked-up-from-his-home](https://www.dhakatribune.com/bangladesh/dhaka/2018/08/05/photographer-shahidul-alam-picked-up-from-his-home)

*LINK TO FACEBOOK POST CLAIMING ABDUCTION:* [https://www.facebook.com/Drik.bd/posts/1944838148905677](https://www.facebook.com/Drik.bd/posts/1944838148905677)

**22. Bus services will resume Monday**

LINK TO ARTICLE: [https://www.dhakatribune.com/bangladesh/2018/08/06/bus-services-to-resume-monday](https://www.dhakatribune.com/bangladesh/2018/08/06/bus-services-to-resume-monday)

**Informative Links**

**1. Link to website that serves to maintain compounding evidence against BCL (courtesy of** [**u/r0tekatze**](https://www.reddit.com/u/r0tekatze)**)**

*LINK:* [http://vixendev.co.uk/resources/sanctuary5/index.html](http://vixendev.co.uk/resources/sanctuary5/index.html)

**2.  Live feed of protests**

*LINK:* [https://www.reddit.com/live/11e4mknpbhjqr/](https://www.reddit.com/live/11e4mknpbhjqr/)

This is just some of the information I have compiled. There is plenty of information that I have not included.",6,t1_e3o4nk5,2,1533508616.0
"^(Hi, I'm a bot for linking direct images of albums with only 1 image)

**https://i.imgur.com/jAnc58o.png**

**https://i.imgur.com/OT0ul7h.jpg**

^^[Source](https://github.com/AUTplayed/imguralbumbot) ^^| ^^[Why?](https://github.com/AUTplayed/imguralbumbot/blob/master/README.md) ^^| ^^[Creator](https://np.reddit.com/user/AUTplayed/) ^^| ^^[ignoreme](https://np.reddit.com/message/compose/?to=imguralbumbot&subject=ignoreme&message=ignoreme) ^^| ^^[deletthis](https://np.reddit.com/message/compose/?to=imguralbumbot&subject=delet%20this&message=delet%20this%20e3o4ns9) ",1,t1_e3o4nk5,2,1533508524.0
I cannot see some of the video links.. were they taken down? ,1,t1_e3o4nk5,2,1533513914.0
"Ok good, try and let everyone you know about it, I'm doing the same",7,t1_e3ni1fc,2,1533486256.0
fuck,3,t1_e3o0ytz,2,1533506325.0
Well Shit,3,t1_e3o0ytz,2,1533507203.0
"By Reddit themselves?

I have a forum I host, I am willing to setup a section just for this.  It's not a very active forum though so it kinda defeats the purpose... but it will make for a place to discuss the ongoing issues.  

If you guys think this could help I can set it up. ",2,t1_e3o0ytz,2,1533506290.0
"There is sources though. The Guardian has done an article, Dhaka Tribune has done several. ",3,t1_e3obo4t,2,1533522106.0
"I'd say first accounts from people actually affected with tons of videos is quite a credible source. It's just not ""official"", so don't know how you turn that into an official news article. Not sure how all that works tbh. ",3,t1_e3obo4t,2,1533525229.0
"Facebook in Bangladesh and worldwide has taken down posts. Youtube global has deleted videos. Reddit has taken down the top posts from front page. Worldwide media has sanitized the story. Eyewitness accounts and videos are not being reported.

Keep reporting, keep sharing. Do the job that those in power will not do.",5,t1_e3p1ev2,2,1533579755.0
Thank you! And you're welcome. We have to help each other as people.,3,t1_e3ovng0,2,1533565605.0
Trying to figure out how would I upload them here.....,1,t1_e3ruaqm,2,1533663032.0
I can still see the text. No clue what's wrong. [https://imgur.com/cQf8SHt](https://imgur.com/cQf8SHt),6,t1_e3lb3u2,2,1533388382.0
experienced the same thing. however i do not have any karma points. is that the reason? ,1,t1_e3lb3u2,2,1533389870.0
A link for those of us who don't use Apple devices?,2,t1_e3nfjh7,2,1533484971.0
"Can you explain? I don't see it anywhere when I look at /r/worldnews/ subreddit.  When mods delete threads you can still see them with the link, but it's invisible to anyone looking at a subreddit.  

It's also completely unchanging in upvotes. I am sure it is removed.",4,t1_e3n7722,2,1533473995.0
I'm looking for corroboration/ confirmation on the same. ,3,t1_e3r8hu8,2,1533643092.0
[deleted],5,t1_e3n37ee,2,1533466604.0
"[One from me, one from my friend ](https://vgy.me/album/LmA6z9ng)  
",5,t1_e3pzs7p,2,1533587698.0
It has been blocked since day before yesterday and I can recall that someone already mentioned that on the live thread.,2,t1_e3pzs7p,2,1533587407.0
Weird. No reason to remove it. ,3,t1_e3n3azc,2,1533467349.0
"Can you message this guy and ask if you can help him, or if he knows who to ask about it.  [Here](https://www.reddit.com/r/bangladesh/comments/94r3wa/i_urge_you_to_get_organized_here_on_reddit_to/e3n3vsa/)   Ask BengaliAbroad if you can help.",1,t1_e3n5k0h,2,1533471264.0
"Are u serious? 😲

Got any source? ",3,t1_e3o3eod,2,1533509493.0
hey! I don't think thats a big issue. I will add the video links here as well and ask the translators to put their translations up here rather than the live feed. ,1,t1_e3mphwc,2,1533442675.0
mirror - http://www.mediafire.com/file/rzucyrdo3aucfrn/Bangladeshi+politician+confesses+to+beating+children+on+live+national+TV.MP4,4,t1_e3m2ubg,2,1533417379.0
Thank you for the information.,2,t1_e3ngv0m,2,1533485163.0
"I can't help with a lot (my own debt is crushing), but I can at least throw a little bit of my disposable income. ",2,t1_e3sbxue,2,1533708986.0
"ok, thanks.",2,t1_e3rkyeq,2,1533655777.0
I am willing to contribute to Akib's care if someone starts the gofundme. I'm not fluent in Bengali and will have trouble communicating with the recipients. ,2,t1_e3s22g8,2,1533669556.0
Will do. I just waiting for Google to verify account creation.,4,t1_e3n0sus,2,1533461042.0
Yup :(,5,t1_e3nnhxw,2,1533494529.0
"They posted it today So I guessed it happened recently, but they said it was on Monday evening (?). So it might not be today...",4,t1_e3ns2zf,2,1533496419.0
got deleted like every other videos,3,t1_e3nuklg,2,1533503668.0
Thanks,2,t1_e3qvawl,2,1533618927.0
"But it was slowed down, right? Is it back to normal?  I read they slowed it down to prevent videos from being uploaded.",2,t1_e3qvawl,2,1533635335.0
Try adding yourself to the group [Voice of Rights](https://www.facebook.com/groups/voiceofrigthts/). It is probably the most active group on the issue so far. You get all the updates and posts there. Please evaluate before taking them seriously.  ,3,t1_e3l96xr,2,1533397821.0
[Quazi Nowshaba Ahmed is a witness](https://m.facebook.com/story.php?story_fbid=2380129505345421&id=100000451833991),2,t1_e3l96xr,2,1533389386.0
"She is urging the evil, heartless parents and teachers to not send their innocent, soft-hearted children off to the streets to take out on their naïve, silly concerns over such trivial matters as road safety, because of course the gov is working tirelessly for the country’s progress in every sphere including road safety, as it had always been doing even before these silly protests.

This Machivellian honourless bitch is known for her cunning soft words I’m telling ya.
",23,t1_e3mt0vr,2,1533447935.0
Translation in the Reddit live thread,2,t1_e3mt0vr,2,1533447783.0
Ah okay. I have seen a lot about how they are stopping busses to make sure that the driver has a license. Are the drivers hired by the government? Is that why the government got involved?,1,t1_e3mi5is,2,1533433874.0
Thanks for this! Makes sense to me now.,1,t1_e3n09ua,2,1533531197.0
"These riots started when someone got hit by a bus...  


What politics is involved in a traffic accident...",-34,t1_e3nkwjg,2,1533489169.0
"Good to know that. I'm working on creating a full report on all the incidents up until now, since July 30th. ",23,t1_e3lg1il,3,1533396748.0
"Hey, thank you for doing this!

Consider asking the reddit admin u/sodypop if he could help you guys with visibility. This needs more coverage I think. Out here in the West it's reported very little.",6,t1_e3m4kg1,3,1533430033.0
can you still use fb on wifi? this maybe due to the mobile internet being shut down. ,7,t1_e3lp526,3,1533404637.0
Please and thank you,4,t1_e3mahnw,3,1533425740.0
thank you will check it out now. ,1,t1_e3mhucq,3,1533438136.0
"F****** =/

Edit: Language",1,t1_e3lp4f5,3,1533439361.0
"NYTimes was incredibly slow to cover this story. Up until yesterday, if you visited the World news section of NYTimes - nothing. If you visited the Asia page - nothing. Just a few tiny articles from AP that were buried.  

Also, many women were raped and people were killed. That should be part of the story - but it always seems to be missing.",4,t1_e3otaui,3,1533553704.0
Let's hope for the best and prepare for the worst!,3,t1_e3n2mdv,3,1533470263.0
They were just moved to a different folder. I've edited them now and they all seem to be working,2,t1_e3o9nk3,3,1533525377.0
"I don’t know where to post it, so as soon as I’m done I’ll dm it to you",4,t1_e3ni333,3,1533486283.0
"I'm doing my best to try and raise awareness on Twitter, before it use to say trending under #WeDemandJustice but now there is nothing. Nothing like it doesnt matter ):",2,t1_e3o2h81,3,1533507311.0
I'm not very active on many things. Just a lurker. Just trying to do my best here and there with Twitter. ,2,t1_e3o2h81,3,1533507399.0
That would be great if that was actually happening. But it isn't. ,1,t1_e3ok92c,3,1533544298.0
what are you trying to upload? videos - use streamable pics use imgur,1,t1_e3rvfdc,3,1533663843.0
I'm not sure! Can someone with higher karma post the news? ,2,t1_e3lcs00,3,1533392499.0
Certainly:  https://play.google.com/store/apps/details?id=com.opengarden.firechat&hl=en_US,3,t1_e3ngtfz,3,1533485849.0
Also: https://firechat.en.uptodown.com/android,3,t1_e3ngtfz,3,1533486072.0
"I thought since I can open the link it's not removed. Otherwise it would have said ""[removed]"".

Edit: I checked it I too didn't find that post :/ .It might have removed.",4,t1_e3n7iea,3,1533474250.0
He said that the list got copied and pasted onto several other timelines. Reporting the group wont help that,6,t1_e3n3dzj,3,1533467106.0
thanks. ,3,t1_e3q0m7x,3,1533587963.0
Unless if the government did it,2,t1_e3n3qj9,3,1533468261.0
Askreddit has a rule of not allowing text in text boxes. ,1,t1_e3n3qj9,3,1533467726.0
"Thanks, in the same boat here. But every bit helps. 

Could you also please help share? 

If today we help someone, tomorrow if we need help someone will help us. That how karma rolls, yes?",1,t1_e3t7e5k,3,1533710458.0
"we are trying to get in touch with the family and see how we can setup a gofundme
",1,t1_e3s3km2,3,1533669692.0
May I ask what was to see on the video ,1,t1_e3nzsj8,3,1533518567.0
"Yes, they slowed it down to 2G frome 4G, but now it's back to 4G",2,t1_e3r53fy,3,1533639534.0
"if you listen to her with a different perception, her speech sure sounds like a threat. 

""Take back your children or they won't be safe on streets""

Damn woman! Why would you be the PM and not ensure safety of your children? ",11,t1_e3mtwv0,3,1533458298.0
"I could definitely be wrong here, but I think the licenses are issued by the government, like they are in the US. Also, it seems like the bus companies have a strong lobbying arm into legislation that could address these issues. ",3,t1_e3mi7re,3,1533434490.0
"Have you not read anything?

Peaceful protests starting in response to the bus killing 2 kids, the students rose up and want safer driving laws and conditions. Something which is entirely logical and reasonable.

In response, the government turned on them instead of just accepting it. Started killing protesters among other things. Due to them having investments in the bus companies that are effectively running illegally even though the laws are not being enforced.

This is 100% political, a corrupt government finally going completely against it's people in the interest of money.",28,t1_e3nl0rq,3,1533489399.0
can you please share your report? I live in the US and am trying to get the attention of some of the organizations I belong to spread awareness. ,21,t1_e3lirvb,4,1533396960.0
"I am connected fo wifi. I can browse using web, but can't using lite app.",9,t1_e3lqmfj,4,1533405850.0
I did. It's 2AM but if there's anything I could be useful for please tell me.,3,t1_e3maub0,4,1533425859.0
I did. It's 2AM but if there's anything I could be useful for please tell me.,2,t1_e3maub0,4,1533425849.0
Can you share the evidence of it? It is important to document evidence to claims. ,1,t1_e3p1bhr,4,1533594115.0
"I won't be able to do anything with it sadly, ill have no service or wifi for the next week so just try and tell people",4,t1_e3ni44r,4,1533486342.0
https://imgur.com/a/Wa8Lcsh,2,t1_e3rwgzn,4,1533664019.0
http://imgur.com/a/sMfg6SN,2,t1_e3rwgzn,4,1533664631.0
"So, technically they did not delete the OP (it would say [removed]) but they have hidden it so no one can see it.  I don't know the reddit term, but they deleted it by making it invisible.",4,t1_e3n7ofr,4,1533474419.0
[deleted],5,t1_e3n3mf8,4,1533467567.0
There is no text in textbox. See it again ,1,t1_e3n3x0j,4,1533467979.0
"been sharing with friends, family, and everyone I can on forums (appropriate places) and discord servers I frequent.",2,t1_e3t89hj,4,1533794640.0
Thank you and /u/littlebluish for all that y'all are doing. ,2,t1_e3s3qmt,4,1533670564.0
"Would it be possible to create a new stickie post in this sub about the gofundme?  I'm asking you, since you're a mod.",1,t1_e3s3qmt,4,1533675514.0
"So you think a response to a traffic accident is marching around protesting...  
instead of say, electing officials who want to have better traffic laws? Or going to a council meeting? The answer was to disrupt the entire city...  
",-34,t1_e3nl982,4,1533489652.0
"Yes, of course. Of course I can. I'm desperately trying to reach foreign media to cover this. The happenings are outrageous, and it is as if we are enclosed in a country that says it's democratic, but is reigned by dictatorship. I opened a subreddit as a backup just in case they shutdown Facebook, and the govt is already filtering hashtags so organisations cannot receive the messages. ",18,t1_e3liz7x,5,1533398127.0
"Where would you share this if you had it?


I’m thinking about making a post on this subreddit for starters ",3,t1_e3ni68o,5,1533486563.0
Shadowban.,3,t1_e3n7sm4,5,1533478552.0
"I reported the group of course. I just worry it's not enough.

And I haven't been able to access the live thread for almost 10 mins ",4,t1_e3n3u99,5,1533467825.0
"Thanks. Me too. 

I just wish the student protesters who have been arrested get freed  :-( 

",2,t1_e3vf49p,5,1533795154.0
on the sub? or the thread?,1,t1_e3saz72,5,1533675549.0
"You clearly don't grasp the issues of corrupt governments.

Voting isn't the answer in a country with a government that manipulates the votes.",24,t1_e3nlhix,5,1533489762.0
".... and the way to handle protestors is to start killing them ? You know any thing about your country, how it even began or the ruling party. it was made out of the right to protest and exercising it. ",17,t1_e3nlhix,5,1533492159.0
"thats awesome. thank you! also, if you get images, videos, please upload them to imgur so they can be shared later too. ",9,t1_e3lk4ne,6,1533398199.0
"Can you please send me the report as well? I'd really like to do something to raise awareness for this. Also, what is the subreddit you made?",2,t1_e3lk4ne,6,1533427297.0
What's the name of the subreddit? Be sure to back up everything on another hard drive or something.,1,t1_e3lk4ne,6,1533434199.0
Twitter with hashtag WeDemandJustice,2,t1_e3nie1w,6,1533500128.0
"On the sub, please. To make it easily visible and accessible. The other two stickies have quite a lot of info that might confuse visitors. Maybe this thread and the other stickie can link to the gofundme page? Just suggestions. ",1,t1_e3sb0qf,6,1533676005.0
"So you think the answer is for reddit to get involved, play god in the situation by sending money to rioters, and interfering in elections/government operations...  


Did you cry about ""russian collusion"" in the previous american election? ",-14,t1_e3nllxa,6,1533490092.0
"Protesting is fine, but the reason for protesting is more important.   


""The government is taxing me without giving me any representation"" a right to protest  


""A traffic accident happened"" not a reason to protest, that is an individual thing. ",-11,t1_e3no1pl,6,1533492439.0
