Comment Text,Comment Score,Parent Comment ID,Comment Depth,Created Timestamp
"BCL, BSL are taking away cameras from spectators and news reporters. can we get a drone camera there? in jigatola?",108,t3_94a5wd,0,1533390080.0
"It looks like people are using their real names to upload photos, which is dangerous. There are a lot of other ways you can be identified, as well. Any device connecting to the internet has an ""IP address"" that websites can (and almost always) record, **and show your physical location**. (As specific as a ~~neighborhood~~ city block!) Further, your internet provider knows every website you use. Corrupt governments can and will find dissidents this way. Complete safety is impossible, but there are tools the minimize *some* risks. I don't know what kinds of devices people are using, but I'll try to cover the most common operating systems.

My **NON-EXPERT** advice:

The Tor browser is a great, free tool, for just this purpose. If you can't use Tor, there's the ProtonVPN program for Windows and MacOS, which you can use with any browser. It's a little harder to use on phones, because it doesn't have native apps yet, while Tor is available on Android ([Orbot plus Orfox](https://guardianproject.info/releases/)) but not iOS. ProtonVPN has a free tier, which is slow but secure - don't trust any VPN that has no paid tiers. Tor and VPNs encrypt information leaving your computer and pass it through one or more servers around the world, so that websites don't know what device you're browsing from, and the internet company doesn't know what website you're using. For the Tor Browser, use the ""[Bridges](https://www.torproject.org/docs/bridges.html.en)"" mode, so that you won't be identified as a TOR user. For VPNs, be sure to turn the ""start with [OS],"" ""auto connect,"" and ""kill switch"" options on, to minimize risk of accidentally exposing yourself.

One good things about the Tor Browser is that it can be run off of a flash drive, so you can use any computer. It's also standardized and has security settings defaulted so that it's more difficult to ""fingerprint."" If using a VPN, I recommend a new browser and settings/extensions shown [here](https://operational-security.com/3dsc-2-8-adjust-firefox-settings-security/) and [here](https://operational-security.com/firefox-security-privacy-add-ons/), to limit history/cookie collection, in case your computer is taken by police.

Only log into one service at a time, so that you can't be identified by cookies or cross-referencing accounts accessed. If using a VPN and a browser with container tabs, use container tabs if you need to log into multiple services simultaneously. Use a different username (unrelated to your identity/interests/biography - it can even be random, like mine) for each service (a password manager helps with this - keepass is free and there are versions for all operating systems), and don't give any real information when creating an account.

[Tutanota](https://tutanota.com/) is a privacy-respecting email service that you can sign up for with just a username and password, though you can't send or receive emails for 48 hours, if you trip their spam detection algorithm. [ProtonMail](https://protonmail.com/) is a better email provider overall, but requires sms or email confirmation that you're a real person, which would be a problem if your text messages or emails are already being spied on and you can't create a Tutanota account or use an internet based phone number.

Many news organizations use a tool called Secure Drop for uploading things. I don't know much about it, but by all means, use it - it's probably one of the best things you can do, **especially if you have photographs or videos that identify perpetrators of violence**. Thank you to the brave people who brought the protests to out attention, but please go to journalists first, not social media. Tell them everything you can in both English and Bengali - the basic information in English will let them work quickly and they'll find a translator to get the details from the Bengali. Links to news organization tips pages at the bottom - they all have instructions.

For communication within protest groups, ProtonMail is the best encrypted email and [Wire](https://wire.com/) is the best encrypted chat app. [Signal](https://www.signal.org/) uses phone numbers as usernames, which makes networking easier but may identify you. [Sudo](https://sudoapp.com/) (iOS only) gives you nine internet-based phone numbers and email addresses, which would be very difficult for the government to identify. Communication within the Sudo network is encrypted, but a few people downloading it and using the phone numbers and email addresses to create ProtonMail or Wire accounts for other protesters is perhaps a better use, since it's only for iOS. You can get three more identities per device with MySudo (the company is transitioning), but that app comes with very little call time.

Do **NOT** use WhatsApp. Backups aren't encrypted and are on by default and it's owned by facebook, has poor account security and a history of cooperating with oppressive regimes. A lot of news organizations offer to communicate through WhatsApp, but I think that that's because it's popular, not because it's good.

Metadata - sender/recipient and subject lines - isn't usually encrypted within apps, only the messages themselves, so a VPN is important. **Networks can be brought down by identifying who's messaging whom, even if the messages are unreadable**. This is usually done a more powerful government over a long period of time, but know that metadata is powerful - the US kills terrorists based on metadata. Journalists should be removing metadata (type of camera/phone, time, possibly location, etc.) from photos they use, but do it yourself before uploading them, anyway. You should be able to do so from your computer's file browser by right clicking properties>security or the equivalent.

If you need to secure photos/video to share with journalists later, email them to yourself rather than uploading them to social media. Even if they're not cooperating with the government, social media sites can and will delete violent content, just as a matter of policy. **Evidence of war crimes has been lost this way.** For larger files, sync.com is a cloud storage site with 5 gb free that is *probably* safe, but hasn't been audited for security like Tutanota, ProtonMail, Signal, and Wire and isn't old enough to have a track record. They don't ask for much information, and you should be connecting through Tor of a VPN, so there shouldn't be much that could go wrong with sync, anyway. You can use encrypted zip files both for an added layer of security and to reduce upload/download times, though you would need to either skip the encryption or communicate a password when sending the files, of course.

I think all smartphones have full disc encryption as an option in the security settings. Use it, along with a [long passcode](https://operational-security.com/ios-full-disk-encryption/), if you have a smartphone. Disable location tracking and turn it off, whenever you don't need it on and are at a protest. If a police officer takes your phone while it's unlocked, they'll still get everything, but if you're arrested with it locked, it'll be potentially impossible for them to get inside, without you unlocking it. (That said, they could threaten/torture you; you may just be delaying the inevitable.) Computers can be more difficult. It would be easier to use Bleachbit or CCleaner to overwrite anything sensitive immediately after it's been uploaded to the cloud/journalists.

The Electronic Frontier Foundation has a [Surveillance Self-Defense](https://ssd.eff.org/) guide with more information. [Motherboard.Vice.com](https://motherboard.vice.com/en_us/article/a37m4g/the-motherboard-guide-to-avoiding-state-surveillance-privacy-guide), as well. [The Paranoid's Bible](https://paranoidsbible.tumblr.com/post/160173700334/the-paranoids-bible-20) wasn't written with this in mind, but is also good.

ProtonMail uses the same PGP encryption that the EFF recommends, and, [as of last week](https://protonmail.com/blog/address-verification-pgp-support/), can work with out-of-network PGP tools. You also access it completely through an internet browser, so your emails are on a server in Switzerland, rather than your hard drive. Fewer potential points of failure, and you don't need to download anything to your computer for police to find. To send a PGP encrypted email from ProtonMail to a newspaper or journalist, add them to your contacts; [there will be an option to upload their public key](https://protonmail.com/support/knowledge-base/how-to-use-pgp/). With other PGP tools, you either need to install a browser extension and link it to your email account or download Thunderbird and link that, plus a plugin - I think this is a big improvement.

Good luck, everyone! Again, I'm not an ""operational security"" expert, and even if I was, **nothing can eliminate risk in a situation like this**, but this is better than uploading to reddit with your real name, from your regular browser. /r/privacy will try to help you with any questions.

Some news organizations you can contact securely:

https://www.nytimes.com/newsgraphics/2016/news-tips/index.html - A Signal number and PGP key, plus Secure Drop.

https://www.washingtonpost.com/anonymous-news-tips/?noredirect=on&utm_term=.f8a34d5e312e - A Signal number and PGP key, plus Peerio and Secure Drop.

https://www.theguardian.com/help/2016/sep/19/how-to-contact-the-guardian-securely - Three Signal numbers, a PGP key, plus Secure Drop.

https://www.propublica.org/leak-to-us/ - A Signal number and PGP key, plus Secure Drop.

https://theintercept.com/source/ - A Signal number, plus Secure Drop; PGP keys on each journalist's profile.

https://www.ap.org/tips/ - A Signal number, plus Secure Drop; PGP keys on each journalist's profile.

https://www.reuters.com/investigates/special-report/tips/ - A Signal number and PGP key, plus Secure Drop.

Human Rights organizations:

https://www.hrw.org/contact-us

https://www.amnesty.org/en/about-us/contact/",96,t3_94a5wd,0,1533428997.0
"International news coverage so far - 

DW - https://www.dw.com/en/bangladeshi-school-students-take-control-of-dhaka-streets/av-44945036?maca=en-Facebook-sharing

Guardian - https://www.theguardian.com/world/2018/aug/03/teenagers-bring-parts-of-bangladesh-to-a-halt-with-bus-death-protests

Xinhua - http://www.xinhuanet.com/english/2018-07/31/c_137359926.htm

The Diplomat - https://thediplomat.com/2018/08/students-protest-against-reckless-driving-roil-bangladesh/

BBC - https://www.bbc.com/news/world-asia-45048012?SThisFB

Al Jazeera - https://www.aljazeera.com/news/2018/08/bangladesh-mass-student-protests-deadly-road-accident-180802174519088.html

The Rappler - https://www.rappler.com/world/regions/south-central-asia/208710-student-protests-bangladesh-2018",60,t3_94a5wd,0,1533307431.0
AL politician admits to beating children on National TV - https://www.youtube.com/watch?v=7Gu7KU8c924&feature=youtu.be,40,t3_94a5wd,0,1533415644.0
can anyone confirm if mobile internet has been shut down? I am hearing reports of 4G and 3G connectivity being lost. ,39,t3_94a5wd,0,1533397005.0
"**PSA** : If you're sharing videos and pictures of the event on Facebook, please change your password right away to something secure, preferably a 24+ letter ones. use something like LastPass or Bitwarden to generate and save it. I just had 3 unidentified login attempts.",42,t3_94a5wd,0,1533461621.0
"A male student talking about his female friend being abducted-
https://m.facebook.com/story.php?story_fbid=1747580742026209&id=100003229017143",36,t3_94a5wd,0,1533395445.0
Facebook had been shutdown in Bangladesh,30,t3_94a5wd,0,1533399827.0
Is evidence and info being posted from outside of Bangladesh so it can't be taken down? If that's something that would help I can do it (located in US).,24,t3_94a5wd,0,1533482734.0
"Shahidul Alam, prominent photographer and intellectual, has been abducted by the police few minuets ago. He was seen on [this](https://www.facebook.com/shoebrda96/videos/10204761333311379/) AlJazeera report. He was picked up from his home in Dhaka by over 20 law enforcement officers after giving an interview to AlJazeera about the current student protests.  Source: [this Facebook post ](https://www.facebook.com/tanvir.topu/posts/10156257593091628)by another prominent photographer  
",25,t3_94a5wd,0,1533489356.0
"""If you are living in Bashundhara be alert. They just searched my house. Delete any pics you got on your phone. They are searching all phones and laptops. If you are unwilling to open doors, they'll break it down and enter. They asked me to strip and searched my body for rubber bullet marks. It's not a rumour anymore."" https://imgur.com/a/VpxlgeE",24,t3_94a5wd,0,1533753048.0
Can someone post the Dhaka Tribune links on r/worldnews. It won't let me post since my account is new and doesn't have karma.,21,t3_94a5wd,0,1533393048.0
"The best I could do is share the story through my school radio's Instagram account (Switzerland).

Here it is: https://www.instagram.com/p/BmEqJcUA2ut/?utm_source=ig_share_sheet&igshid=17b4z7qw9iw0d

I wrote to all the news agencies I could think about, unfortunately it's midnight here and tomorrow it's Sunday. Doubt anyone works here. No news agency reported this, not even national TV (at least Italian speaking RSI) despite details being well known when aired.

Will try to spam local news more if it doesn't get coverage.",21,t3_94a5wd,0,1533423061.0
"Jigatola turns into battlefield, BGB deployed https://www.dhakatribune.com/bangladesh/dhaka/2018/08/04/live-students-block-streets-in-uttara",19,t3_94a5wd,0,1533384587.0
Correct me if I’m wrong but it’s bewildering to me that the major journalistic sites are still not reporting the events in full? Even the Guardian and BBC articles seemed like the cursory bare minimum,19,t3_94a5wd,0,1533533850.0
"The live thread said students are being burned alive? Is this true? 

Stop, drop and roll. Cover all burns with whatever clean clothing or bandages you can find. And if you see a tear gas grenade coming at you, do what you can to kick it away or pick it up and throw it back. ",17,t3_94a5wd,0,1533457280.0
"It is 1:44 a.m. Pacific Standard Time, where I'm posting. The date is Sunday, 5 August of 2018. 

As of 17 minutes ago, /u/VPM43 has not updated the live thread. I'm inclined to believe the Bangladeshi government has again shut off the internet across the country. 

Anyone who can help provide alternative internet, please do so now. Lives are depending on it. 

EDIT: 

/u/VPM43 has updated at 1:53 a.m., but needs help. ",16,t3_94a5wd,0,1533458614.0
"[The Guardian has a published a very truthful article regarding the situation today at 7:06 AM EDT (8:06 AM EST).](https://www.theguardian.com/world/2018/aug/05/bangladesh-pm-urges-teen-protesters-to-go-home-amid-violence)

It appears on [news.google.com](https://news.google.com/topics/CAAqJggKIiBDQkFTRWdvSUwyMHZNRGx1YlY4U0FtVnVHZ0pWVXlnQVAB?hl=en-US&gl=US&ceid=US%3Aen) as the 13th link on the front page under the ""World"" category",17,t3_94a5wd,0,1533491486.0
"[https://www.theglobeandmail.com/world/article-bangladesh-cracks-down-on-dangerous-driving-after-protests/](https://www.theglobeandmail.com/world/article-bangladesh-cracks-down-on-dangerous-driving-after-protests/)

This is how international media is reporting on what's happening. ",17,t3_94a5wd,0,1533497024.0
"It’s great that all this evidence is being collated, but has anyone been contacting the South Asia news desk for the various international news outlets? It needs to gain traction and go up the ladder for the respective agencies before they splash it all over their main pages.

Reuters, AFP, BBC, Al-J and the like all have regional subdivisions with local reporters...it’s them who need to be tweeted at, not the organisation at the top level.

Also try non traditional media. These events are bread and butter for the folks behind Vice News, Daily Show, John Oliver, Samantha Bee, Jim Jeffries, The Last Leg with Adam Hills and their ilk. Their researchers may help give you coverage.",16,t3_94a5wd,0,1533515795.0
Now #WeDemandJustice is being censored on Twitter...what is going on?!,17,t3_94a5wd,0,1533504770.0
"There has not been a lot of news coverage here in America and I hope that we can all bring more awareness to what is currently occurring on the other side of the world. I compiled a list of what has happened and some links to more information. If anything is wrong just let me know and I’ll get to it when I can. This is by no means a complete list, just a broad overview of what is happening.

Currently, the Bangladesh government is trying to squash people's attempts to speak out against the violence that is occurring under the pretense of stopping ""fake news"" from spreading. To give you context of the situation at hand, two school bus drivers were recklessly racing one another to pick up passengers and led to the killing of two students. This resulted in public outrage and protest that was greatly fueled by comments made by Shajahan Khan, President of the Road Transport Federation. What started off as a peaceful, student movement against the killing of two students and road safety, has ended in bloodshed and violence. Several attacks are being made on students and journalists allegedly from the Bangladesh Chhatra League (BCL), a corrupt youth organization linked to the Awami League.

I understand a lot of this is fairly recent and it's hard to pinpoint the truth in some of claims being made in the social media chaos that is ensuing, but the amount of evidence (photos, videos,articles) that is fitting the civilian’s narrative better than the governments is outstanding (see links below).

We cannot let a corrupt system take advantage over these people. We need to let as many people know the terrifying reality that is occurring right now. It is a warning to all of us of what can occur when the wrong people have too much power. As of now, the government has made attempts to cut off mobile internet, stop news outlets from reporting on the incidents, and change the narrative so it would fall in their favor.",15,t3_94a5wd,0,1533508487.0
"Link to article published by BBC talking about some of the protests, some quotes and other things. 

https://www.google.com/amp/s/www.bbc.com/news/amp/world-asia-45074384 ",12,t3_94a5wd,0,1533485609.0
"Attacks on students & protesters - 

https://www.dhakatribune.com/bangladesh/dhaka/2018/08/02/chhatra-league-jubo-league-police-assault-and-chase-away-protesters-students-claim

ULAB students attacked after demonstration, allegedly by chatra league - https://www.dhakatribune.com/bangladesh/dhaka/2018/08/03/demonstrating-ulab-students-under-attack

",15,t3_94a5wd,0,1533308590.0
"A petition to the UN to enlist BCL, the student wing of the ruling Awami League party, as a terrorist organization is being circulated - https://www.change.org/p/united-nations-enlist-bangladesh-chhatra-league-bcl-as-a-terrorist-organization?signed=true",13,t3_94a5wd,0,1533447566.0
Photographer and social activist Shahidul Alam abducted from his home after giving an interview on Al Jazeera https://m.facebook.com/story.php?story_fbid=10156648541748824&id=654418823,13,t3_94a5wd,0,1533491784.0
"I keep seeing the odd post hit the front page then vanish.  Just thought I would mention that, there may be some funny business going on with this whole ordeal.  Somebody is censoring this incident from spreading.   Either bots, or maybe Reddit themselves being ordered to delete/modify ranking of posts?  I don't want to start any conspiracies but something worth looking into. 

I have yet to see anything show up on our news (Canada).  I really don't know how that works, how can I make them aware of this?  Do I need to write a news article myself and submit it?  Do I contact my MP and they handle it?  Can I just give them this thread or do they need a ""credible"" source like an existing news article?  ",14,t3_94a5wd,0,1533503865.0
"I don't support alot of movements. I could've been supporting the situation in the Middle East, or the crisis in Venezuela. But I'm currently not. So why am I supporting this particular protest? Because of alot of reasons, most of which are the blatant violations of human rights (which is a huge point of the protest). But the main reason for me is censorship. And I HATE censorship. I hate being silenced and having my voice muted. Their government is taking down media and posts that were supposed to spread the untarnished truth of their grim situation. This makes it more important than ever to speak out. A government that causes problems and subsequently hides those problems, is an inhumane government. Some might argue that sharing on social media or signing some petition would just be ineffective slacktivism. But it's that attitude that suppresses the message from reaching the attention of both the masses and the international authority. We need two things from the world: their undivided attention, and their undying support. The second part should be easy as what is shown is obviously and undeniably wrong. But we haven't finished the first step yet. And hitting that share button or that ""sign this petition"" button might do just that, if enough people do it.

I am making 2 points. That the government of Bangladesh is a horrible one. And that one should not think that they cannot do anything that makes a difference. Speak out. Let the world be able to watch with understanding eyes. ",24,t3_94a5wd,0,1533523153.0
"Actress Nowshaba has been arrested
https://www.facebook.com/141195262639627/posts/1861766053915864/",12,t3_94a5wd,0,1533400191.0
[removed],11,t3_94a5wd,0,1533495206.0
"Hello, I am Slovak and know both English and German well, if there are any sources in either English or German that (rather English) talk about what is going on I could translate them into Slovak and share them. Could you please send me links? I have only seen links for translation to English, but I can't help with those unfortunately",11,t3_94a5wd,0,1533537775.0
"Update:
Check twitter with #roadsafety tag, it is getting filled with hundreds of same tweets. Guessing that the ruling party has finally figured out how to manipulate cyberspace to their advantage.",14,t3_94a5wd,0,1533661179.0
"Last update, Aug 9, Thursday, 10.30 AM EST, 8.30 PM Bangladesh time - 

Not much has happened in the city in the last 24 hours. 22 private uni students who have been arrested and denied bail have been taken into remand. 

[High Court has ordered a fresh medical checkup on Shahidul Alam to see if he has been tortured.](https://www.dhakatribune.com/bangladesh/court/2018/08/09/hc-orders-shahidul-alam-s-fresh-medical-check-up)

[Road Transport owners are checking papers and licenses of drivers.](https://www.thedailystar.net/city/transport-owners-check-licences-papers-at-bus-terminals-1618186)

[The CEO of Zoombangla, an online news portal, and a BUET student, have been arrested and their devices seized for spreading ""fake news"" to incite unrest and violence during the protests.](https://www.dhakatribune.com/bangladesh/dhaka/2018/08/09/web-portal-s-ceo-buet-student-held-for-publishing-fake-news-spreading-rumours)

[The Supreme Court has upheld the 5 lakh taka compensation for the victims of road accident on July 29 that sparked the protests.](https://www.thedailystar.net/news/city/dhaka-airport-road-accident-bangladesh-supreme-court-upholds-5-lakh-taka-compensation-to-victims-families-1618225)

This thread will be locked for comments now. [If you want to help, see here.] (https://www.reddit.com/r/bangladesh/comments/94rfy3/how_you_can_help_please_read/)",1,t3_94a5wd,0,1533824849.0
"Please upvote this thread:  How You Can Help. We are trying to organize and want this thread so people can ask for help or list ways others can help the people there.  
https://www.reddit.com/r/bangladesh/comments/94rfy3/how_you_can_help_please_read/   ",21,t3_94a5wd,0,1533473053.0
"u/rambobilai, let's try to get this news to globaltalk. We need the world to know this. I started a thread, if you want you can take over it.   


[https://www.reddit.com/r/GlobalTalk/comments/94ivwt/bangladesh\_violence\_unleashed\_upon\_student/](https://www.reddit.com/r/GlobalTalk/comments/94ivwt/bangladesh_violence_unleashed_upon_student/) ",10,t3_94a5wd,0,1533386979.0
Guys here from Nepal. I personally feel disgusted towards your government and I can’t bear reading the news anymore. All I can do it support you all via social media which I’ve done. I just want you guys to be strong and know that the whole world is in your support. It would also be helpful if you keep your further update in English or English + bangla. Thank you. Lots of love and courage.,11,t3_94a5wd,0,1533431042.0
"[https://old.reddit.com/r/teenagers/comments/94kx7o/teenagers\_are\_being\_murdered\_raped\_and\_silenced/](https://old.reddit.com/r/teenagers/comments/94kx7o/teenagers_are_being_murdered_raped_and_silenced/)

The teenagers of the world are coming to attention.

Since the WiFi is being messed with, radio communication might be a good tool for live updates. Does anybody know anything about HAMs/private radio operators in Bangladesh?",10,t3_94a5wd,0,1533437209.0
