Comment Text,Comment Score,Parent Comment ID,Comment Depth,Created Timestamp
"We have gotten in touch with them, there has been no response as of now from them. ",3,t1_e3ofst9,1,1533537473.0
That was in India genius,7,t1_e3nez1x,1,1533483961.0
"WTf are you even talking about? 
Edit: Did you even read the whole thing? 
Are you saying we initiated a protest in Bangladesh to promote a fucking app? Are u that dense or just plan stupid? ",2,t1_e3ouyad,1,1533543935.0
What app ? Are you a fucking moron ?,1,t1_e3ouyad,1,1533545216.0
Modi is behind what?,1,t1_e3sozqa,1,1533709164.0
"We're all human beings, nowadays it's very difficult for any kind of resistance to beat a government without external support due to the massive surge of military technology. 

Gang rape, the beating of journalists, students being shot or having their eyes torn out for peaceful protesting is not something that I would accept anywhere, whether that's my home country or not it does not matter. People are people, and we need to work together to end mass breaches of human rights. 


There's an [old poem](https://en.wikipedia.org/wiki/First_they_came_...) you may find interesting to think about.

""First they came for the socialists, and I did not speak out—
     Because I was not a socialist.

Then they came for the trade unionists, and I did not speak out—
     Because I was not a trade unionist.

Then they came for the Jews, and I did not speak out—
     Because I was not a Jew.

Then they came for me—and there was no one left to speak for me."" - Martin Niemöller. ",28,t1_e3njhho,1,1533488197.0
"Here's an idea, why don't you get your head out of your ass, and have some common decency and concern for the wellbeing of your fellow man? We're all hurtling through space on this stupid rock together, so we might as well help each other out.",4,t1_e3njhho,1,1533502351.0
do tell me what propaganda I am spreading?,2,t1_e3nvh45,1,1533500032.0
"A list of people who were sheltering protesters got leaked and spread around, leading people to gear for their safety",59,t1_e3ncwh6,2,1533483341.0
"Yes, please get John Oliver on this. He seems like a truly wonderful person and deserves more attention and is fortunately getting it as of late. I hear a lot of older people who don’t realize John Oliver is on the scene lamenting the loss of Jon Stewart from the public eye. ",9,t1_e3ocdss,2,1533517972.0
He can’t really engineer a solution to a violent authoritarian regime. ,87,t1_e3nf3h8,2,1533484937.0
"In this case it's not even what he can do but getting a response and having media expose what's happening. An article on Musk's comment will help a ton as well. 

In terms of why even ask him, Starlink (iir the name correctly) is his project for satellite based international internet. Seeing that internet was cut, that's something worth tweeting about.",35,t1_e3nf3h8,2,1533487978.0
"Hey Musk, hurry up with self-driving buses because the people here can't drive safely and aren't even made to follow traffic laws or face punishment.",15,t1_e3nf3h8,2,1533499666.0
"Fuck elon musk, he can't and won't do anything to help.",7,t1_e3nf3h8,2,1533506390.0
Only to serve his interests. Otherwise he’ll accuse you of being a paedo.,2,t1_e3nf3h8,2,1533516643.0
"Would incentivizing people to keep a pen drive or something with th FireChat apk a good idea?

https://firechat.en.uptodown.com/android

That way you can continue spreading the app to more users w/o Internet",120,t1_e3n8y3k,2,1533483675.0
"> NO!!! WTF are people using a closed source app for sensitive communications for??? In that region that can literally mean suicide for people using that app. Please at least use open source apps with end-to-end encryption like Briar (decentralized and can work via Bluetooth and WiFi) or a client based on the Matrix protocol like Riot.im, or Wire (which works like Signal but does not depend on phone numbers) Please, don't go around spreading dangerous infosec advice, because it can literally mean life or death. Edit: Jesus Christ people, Firechat literally requires Google Play services. That is not a way to run a privacy app: http://breizh-entropy.org/~nameless/random/posts/firechat_and_nearby_communication/

From u/halpcomputar",112,t1_e3n8y3k,2,1533490460.0
"Minnesota, United States here, wandered in from /r/all 

Would you mind telling me please what is going on? Maybe if more knew we might be able to help.

Thank you.",29,t1_e3n8y3k,2,1533489201.0
"Please consider using Briar instead of FireChat:

https://www.reddit.com/r/bangladesh/comments/94rfy3/how_you_can_help_please_read/e3nuwoi/

And **PLEASE actively mention the risks associated with FireChat!**
",8,t1_e3n8y3k,2,1533499540.0
"Use https://html.brow.sh to compress all web pages into text.

Eg; https://html.brow.sh/https://www.reddit.com/r/bangladesh/comments/94rfy3/how_you_can_help_please_read/ converts the page from 3.73Mb to 39kb",1,t1_e3ngpgm,2,1533519429.0
"Where is the iPhone client? Terrible idea. Also, the risk detailed in the article still holds true for other FOSS applications. It doesn't change anything, the governemnt can access them as well. Assuming Google will not sentence many people to death, it's an absolutely terrible idea to switch to something that doesn't work on both Android and iOS.",2,t1_e3nuwoi,2,1533507128.0
[deleted],111,t1_e3n8a2s,2,1533480676.0
Actually no. Telegram is not a safe option at all. Use signal. ,11,t1_e3n8a2s,2,1533485029.0
"I think it uses Bluetooth and WiFi Direct or something, which allows connecting directly to a device or group of devices rather than connecting via the Internet. ",1,t1_e3noj8r,2,1533577234.0
"Contacted him through Twitter, I hope I wasn't the only one so we can get more traction on the matter.",13,t1_e3ngend,2,1533495983.0
"I messaged JK Films, although they are a satire news channel, it still helps to try",12,t1_e3ngend,2,1533489759.0
"Someone posted the addresses of students. The government can sent people to their house (and kidnap/kill/beat up badly the students).  The idea was to get FB to remove that information, as it puts their lives at risk.",24,t1_e3n7s40,2,1533474574.0
"Not just the news organisations, you need to tweet the evidence to the South Asian desk. It needs to go up the chain and it’s the reporters involved with the regional subdivision who will investigate more and push the story. Tweeting the organisation at the top level will have little effect. ",4,t1_e3n7f34,2,1533516567.0
People are tweeting to use #WeDemandJustice after the government was censoring #WeWantJustice,66,t1_e3n7nki,2,1533474819.0
Yeah I’m trying to spread the #WeDemandJustice tag around. Also have contacted my reps to see if any kind of support can be sent. A little surprised its not getting more attention after that diplomats car was attacked. ,4,t1_e3n7nki,2,1533489666.0
"That ceartainly is a great idea, the only issue is that it may turn the situation into a war, Countries like England are going through massive changes, but the government knows of the situation, their official broadcasting centre has been releasing stories but I'm not sure what they're doing..  [The USA did try to send an envoy(A peace offering)](https://www.bbc.com/news/world-asia-45074384) but it was attacked, and I'm not sure what they're doing now.

I'm not sure what's going on in China, but they may be able to do something, along with Russia and India. Here in Canada the news is pretty barren, I've contacted represtentatives and such, so I'll update you with what happens.  


How are you guys doing for food, medical supplies and such? How about phone power?  


I'm going to put a word in with some charities, they may be able to help send supplies, but I'm not to sure about that. ",26,t1_e3n93bs,2,1533485243.0
"I spent some time trying to find a quickstart guide and came up with an awful lot of academic papers and free internet activism, which are all well and good but there isn't really time for that here, those were the *least* fluffy descriptions I could find. I'm working on a quicker guide, but [this link](http://communitytechnology.github.io/) should give a good description on how to build a network under the ""Neighborhood Network Construction Kit"" heading. This is the organisation that built the permanent networks in Detroit a few years ago, including training people to be their own network engineers, so it should be a good resource. Also I've reached out to some communities and individuals to work on a quick setup guide, but this seems challenging enough that it might not be possible. 

Edit: started a thread over at r/darknetplan, feel free to follow the discussion [here](https://old.reddit.com/r/darknetplan/comments/94tz1j/emergency_meshnet_setup_guide/)",3,t1_e3nd84q,2,1533492467.0
post some midget porn ;) facebook will ban it asap,18,t1_e3nkq0r,2,1533489817.0
Report every single post. Maybe eventually Facebook will shut it down just to stop the influx of reports. ,12,t1_e3njkuz,2,1533493737.0
the discussion section people are posting profiles of facebook users who have posted updates on facebook. ,26,t1_e3nhy9w,2,1533486215.0
We need more solid way to get this information out to get this info out to people. ,5,t1_e3nnkpi,2,1533493774.0
This is the Facebook group where the location of the shelters are leaked. https://m.facebook.com/groups/natashanawar/,15,t1_e3nd265,2,1533481792.0
"I used the one on their website, newsATskynews.com",1,t1_e3og0lo,2,1533540496.0
"Meant to edit the comment above but it deleted. Contacted local BD high consulate in my country, do this in your country to put pressure on gov & contact local reps and senators!! They can’t get away with this!!",6,t1_e3nwyab,2,1533501231.0
"Copy-pastable link for mobile users:

https://www.change.org/p/united-nations-enlist-bangladesh-chhatra-league-bcl-as-a-terrorist-organization",1,t1_e3nwyab,2,1533504780.0
"That's a good idea, I'll try to set that up in keys subs/posts asap, that said other than targeting r/bangladesh it would be hard to find who's in Bangladesh",3,t1_e3nrcn4,2,1533495617.0
Canadian here! Is there a petition to send to our lovely PM too? ,3,t1_e3nu4kb,2,1533509530.0
This is not the place or time.,8,t1_e3o0av5,2,1533516055.0
"Sorry I didn't reply sooner!

You can use [this tool](https://www.ourcommons.ca/parliamentarians/en/constituencies/FindMP) to find your local MP based on postal code. You can find the email and mailing address for Chrystia Freeland, the minister of foreign affairs, here (no hyperlink since reddit doesn't like urls with brackets at the end): https://www.ourcommons.ca/Parliamentarians/en/members/Chrystia-Freeland(84665)

I encourage you to contact them. Freeland may or may not write back, but your local MP is often interested in hearing what their constituents have to say. It costs us nothing to try to make our voice heard, anyways.
",2,t1_e3o0zen,2,1533614688.0
"this is the only gofundme that i am aware of that has been verified. There are risks of getting scammed in situations like this, so please try and verify the source if you come across any other. ",1,t1_e3tq97r,2,1533739627.0
Really quick way in the US to not only find out who represents you but to also contact them is to text RESIST at 50409. It will ask you for your name & address. You can also submit what you write to your local paper. Some people do still read the paper after all. But calling them is still way better - you can always do both! ,9,t1_e3ngw3g,2,1533485845.0
"We have tried to get in touch with him, but he hasn't responded to any of our messages or emails. ",1,t1_e3raout,2,1533644944.0
"Here is what shr has sent back to me with my and her names edited out:

Hey *****, thanks for sharing this with me. NPR’s Goats and Soda blog is running a story on this today, so look out for it. There might be some coverage of it on our major magazine shows like Morning Edition or All Things Considered, but I’m not sure.

I have already directed her to the live thread and am still talking to her about what can be done to get the word out.

Edit: sorry it has taken me so long to get back to you about it ive been at work driving all day.",1,t1_e3p2yhw,2,1533586717.0
"Most haven't realized that, I'm using the old ones and the new one in tandem to get maximum exposure as most people abroad are still using the old one",1,t1_e3p7zxw,2,1533562908.0
Thank you!,1,t1_e3piq4k,2,1533577195.0
"I don't know what is worse, that either you would knowingly lie and be super disingenuous, or that you are ignorant enough to actually believe that.

Here they are splitting heads open of peaceful protestors on their knees.

http://www.berkeleyside.com/2017/05/26/eric-clanton-charged-four-counts-assault-deadly-weapon

Here they are attacking innocent bystanders with sucker punches and pepper spray.

https://gfycat.com/ThatGaseousCurlew

You are literally supporting fascism if you support antifa. Their name stands for anti first amendment because their only interest is attack and silencing anyone that is not radical, violent leftists like them. Get a fucking clue. ",1,t1_e3odj5e,2,1533551565.0
"I don't know what is worse, that either you would knowingly lie and be super disingenuous, or that you are ignorant enough to actually believe that.

They do not shut down nazis. They are the nazis.

Here they are splitting heads open of peaceful protestors on their knees.

http://www.berkeleyside.com/2017/05/26/eric-clanton-charged-four-counts-assault-deadly-weapon

Here they are attacking innocent bystanders with sucker punches and pepper spray.

https://gfycat.com/ThatGaseousCurlew

You are literally supporting fascism if you support antifa. 
",1,t1_e3o1cyh,2,1533551386.0
>implying all republicans are nazis,-1,t1_e3o1cyh,2,1533515864.0
Found the Antifa soyboy!,-5,t1_e3o1cyh,2,1533516031.0
"I don't know what is worse, that either you would knowingly lie and be super disingenuous, or that you are ignorant enough to actually believe that.

They are the nazis.

Here they are splitting heads open of peaceful protestors on their knees.

http://www.berkeleyside.com/2017/05/26/eric-clanton-charged-four-counts-assault-deadly-weapon

Here they are attacking innocent bystanders with sucker punches and pepper spray.

https://gfycat.com/ThatGaseousCurlew

You are literally supporting fascism if you support antifa. It stands for anti first amendment, not anti fascist. ",1,t1_e3o28es,2,1533551495.0
Found another Antifa soyboy!,-6,t1_e3o28es,2,1533516058.0
"> Antifa are the good guys.

Not ever has a bigger lie been uttered. ",1,t1_e3pdbpd,2,1533579752.0
"He has, I will join the discord as soon as I can once I'm back at home. Very happy to help in any way I can, also, I am Pakistani so I can feel at some level what you guys are going through.",1,t1_e3ot9ai,2,1533537591.0
"I don’t think that tag will trend, seeing it hasn’t already and it’s almost been 24 hrs. I think we probably need to start using a new one and somehow getting the word out...",1,t1_e3ot1jd,2,1533544661.0
[deleted],1,t1_e3ot1jd,2,1533576019.0
Thank you. Ya I have saved everything. Don't know what page to put them under.,1,t1_e3ot0x7,2,1533573601.0
"The JU students march to Dhaka has been postponed as University authorities denied the students a means of transport, citing security reasons.  [Here's the article from DhakaTribune](https://www.dhakatribune.com/bangladesh/nation/2018/08/06/ju-students-postpone-march-to-dhaka). The Education minister has been pressurising universities to stop students from participating in the protests ""by any means"".",1,t1_e3piu7m,2,1533573661.0
"Thanks. But, please there's no need of yelling or bolding. 

",1,t1_e3oz7o0,2,1533549759.0
Thank you so much. ,1,t1_e3oz7o0,2,1533551421.0
Thanks,1,t1_e3oz9l3,2,1533549766.0
"I have a small following on one, and I've spread it there; I'll see about passing it on further. Good luck to all of you - it was wonderful to see people finally protesting, but what it's turned into is terrifying.",1,t1_e3pis90,2,1533574168.0
Thank you for the advice. I'll do what I can,1,t1_e3pircr,2,1534108597.0
Thanks man! Just saw that they took a statement. ,1,t1_e3rzm7p,2,1533666658.0
My bad i meant to say slowly burn her with fire,1,t1_e3t7imi,2,1533781914.0
Thanks! I've already signed the petition on change.org but I'll be sure to actually write to them as well!,1,t1_e3ocg0v,2,1533524546.0
"Two students died in a bus race that had nothing to do with the government. The government can make regulations (which is certainly lacking) but abiding to it is on drivers. Both drivers were arrested. The roads are bad because ex PM Khaleda Zia and her son siphoned off trillions of Taka. During her 5 year tenure in 01-06 Bangladesh was number 1 in whole world in corruption for 5 straight years.

The agitation was made violent as soon as Bangladesh Jatiotabadi Chatra Dal the student wing of Khaleda Zia's BNP joined. JCD has a history of violence and murder not only amongst its faction but is generally a radical Islam supporter and  supported the many killings of secular bloggers and vloggers in Bangladesh. BNP itself is a rabid anti secular party and very very religious. Khaleda follows the footsteps of her dictator husband. Don't forget Jamaat-e-islami a nefarious hardcore Islamic political party who does not believe in secularism. It's student wing is known for bomb attacks and machete killings. It has also committed war crimes during Bangladesh independence fight of 1971. It's leader once boasted of killing 1000 Biharis by himself in a single day. It's student wing Bangladesh Islami Chhatra Shibir supports shariat and supports only madrassa education. In February 2014, US-based defense think tank IHS Jane's published a report titled ""IHS Jane's 2013 Global Terrorism & Insurgency Attack Index"", where Shibir(Bangladesh Islami Chhatra Shibir) ranked third in a list of most active non-state armed groups in 2013.

Every minister has urged students to either go back to classes or be in home. Do accidents not happen in any other part of the world? Bangladesh has a good judicial system. Grievances could have been directed there. It's not like bangladesh is a rich country with surplus budget. 

This agitation is nothing more than a ploy by opposition to sway the democratic election which are to be held later this year. It's politics on dead bodies(*Laash pe rajneeti karna*). The BNP and Jamaat both supported terrorist and militancy in India supporting the ULFA, NSCN (I-M), PLA and other Manipuri outfits found a safe haven in Bangladesh not only morally but financing and giving them living quarters after attack on India.

According to the Saudi authorities, Khaleda Zia and her sons had an investment of around $12 billion in malls and other infrastructural projects in Saudi Arabia with the money amassed through bribery and extortion. As investigations are underway, more facts have surfaced about huge investments by the BNP chief's late son Arafat alias Koko, who died in January 2015. Koko allegedly made enormous investments in Saudi Arabia - all from ill-gotten wealth. He was also wanted in Bangladesh for multiple charges of corruption. Similarly, his brother Tareq Rahman, now in hiding in England, invested several millions of dollars in many foreign destinations with a large chunk of sum in Saudi Arabia and other West Asian countries. Earlier, there were allegations, many supported by evidence, that Tareq had nefarious dealings, including money-laundering and large investments, with the underworld dons, detrimental to Indian security interests. ",-6,t1_e3novkq,2,1533495276.0
"^(Hi, I'm a bot for linking direct images of albums with only 1 image)

**https://i.imgur.com/jAnc58o.png**

**https://i.imgur.com/OT0ul7h.jpg**

^^[Source](https://github.com/AUTplayed/imguralbumbot) ^^| ^^[Why?](https://github.com/AUTplayed/imguralbumbot/blob/master/README.md) ^^| ^^[Creator](https://np.reddit.com/user/AUTplayed/) ^^| ^^[ignoreme](https://np.reddit.com/message/compose/?to=imguralbumbot&subject=ignoreme&message=ignoreme) ^^| ^^[deletthis](https://np.reddit.com/message/compose/?to=imguralbumbot&subject=delet%20this&message=delet%20this%20e3o09wy) ",0,t1_e3o09fo,2,1533504144.0
They can stand with their children.,2,t1_e3nyezx,2,1533539680.0
"Thanks for replying, you must be really busy managing this important post.

Did you contact at the top level or individual regional divisions? Top level will ignore you. The reporters designated with South Asia may actually do something. Most reporters have their own twitter handles anyway.

They may not respond to you individually, but they will investigate if more people contact them...this is where the power of Reddit can come alive and actually make a difference. 

If someone puts the regional news desk or reporter contact info for the various MSM on your ‘how you can help’ post near the top, then chances are more Redditors will pop them a tweet or email. It will gain traction if you make it easier for Redditors and soon those news desks will be overwhelmed by all the messages. Maybe even a draft message to copy paste, or a link to your evidence archive.

Ideally, your ‘how you can help’ post needs two sections: one with all the vital privacy information for those in BD and the second for the rest of us wanting to help and be useful. It’ll be clearer and possibly more engaging.",1,t1_e3ot84h,2,1533537945.0
But but all brown people look the same /s,-3,t1_e3nftug,2,1533485782.0
"1 in 5 fucking post us about students in Bangladesh, we get it but stop filling up Reddit with it. If you fight against the government then do so within the law or prepare to get arrested like anywhere else in the world ",-19,t1_e3nvywo,2,1533500260.0
inb4 he go there with an actual iron-man suits,110,t1_e3ngs8l,3,1533487397.0
Shut your whore mouth daddy Musk can do anything ,34,t1_e3ngs8l,3,1533485923.0
...Giant Death Robots?,13,t1_e3ngs8l,3,1533485200.0
He'd probably try.,4,t1_e3ngs8l,3,1533488930.0
"To be fair, the development of rocketry over the last century has been primarily driven by a need for physical solutions when dealing with opposing regimes from the V2 to the Cold War Space Race to military communications and reconnaissance networks. And if you can land a rocket safely on a boat then you can land a rocket unsafely on infrastructure or operations of a regime.",1,t1_e3ngs8l,3,1533518805.0
It's disgusting watching Musk and his cult latch at every tragedy that comes along these days. First the cave and now this.,8,t1_e3o2kv8,3,1533511093.0
"Honestly, if a guy wants to be worshipped and mainstream, and his methods for doing that are 'being generally helpful.' More power to him",3,t1_e3oc83k,3,1533518696.0
"Yes! Do that. You can also just keep it on your SD card and plug it in, install, unplug the SD. 

You can use amaze file manager to keep the apk encrypted and only decrypt it before installing so even if someone gets the SD they can't know you had that app on it",60,t1_e3nfk3k,3,1533483931.0
"A decentralized network is useless if there aren't enough users. You have to pick a system and stick with it; popularity of the app is the key not being ""better"".",16,t1_e3nmbgn,3,1533499408.0
thank you for someone posting this ,1,t1_e3nmbgn,3,1533499646.0
"Hey! I too also live in the United States but am a concerned Bangladeshi. 

Basically a week ago two school bus drivers in Bangladesh were racing against each other to pick up their passengers. In their race they ended up killing two students. This already sparked outrage at the lack of people that follow the traffic laws; but insensitive comments from our shipping minister Shajahan Khan who is also president of the Road Transport Federation fueled the fire and millions of students took to the streets to protest for the past week. 

The protests were peaceful and there was no intention of violence. These kids were educating drivers on the streets on traffic law, checking if drivers had their licenses, creating lanes for different vehicles, etc. Doing things that our government should have done years ago. Instead of fixing the problem, the government (currently ruled by the Awami League) retaliated yesterday by firing rubber bullets and tear gas at the students. Hundred of terrified girls were kept hostage by the government and police in buildings they took refuge in. Four students died and four girls were allegedly raped. Hundreds more injured, and some aren’t even able to get treated now because the government has threatened retaliation against the doctors/nurses. 

A lot have now took to social media to share pictures and videos as an outcry for help. The Bangladeshi government is censoring everything on the local news and Facebook and YouTube are taking down anything related to the events. The Bangladeshi government have also recently taken away mobile internet in an attempt to hide what they are calling “fake news”. 

And all this because some kids wanted to help people follow traffic laws to make Bangladesh a better place.",166,t1_e3nl1y9,3,1533490625.0
[deleted],16,t1_e3nl1y9,3,1533490875.0
"2 students killed by a bus last week, students demand justice and proper road rules and safety stuff, gov gets pissed, pays off thugs to incite violence. 

The thugs, murder, capture, torture & rape students. ",5,t1_e3nl1y9,3,1533493156.0
