Comment Text,Comment Score,Parent Comment ID,Comment Depth,Created Timestamp
What can I do in Canada? I tried contacting cbc so they can report on it.,1,t3_94rfy3,0,1533572549.0
"When I click on the Edit 11 link (Students in Calcutta) I get this message:

The link you followed may have expired, or the page may only be visible to an audience you're not in.

Has it been removed or is it only visible in certain countries? I'm in the USA",1,t3_94rfy3,0,1533615438.0
https://dpac.uk.net/2018/02/list-of-mps-email-addresses/ Link contains the email of every UK mp for British activists,1,t3_94rfy3,0,1533660135.0
"A student has just been arrested from Sher-E-Bangla Hall, BUET by the police in presence of DU and BUET BCL. Can anyone please get this into the live updates?",1,t3_94rfy3,0,1533663996.0
[deleted],1,t3_94rfy3,0,1533668484.0
Best way to help is to kill the beast. Aka sheikh hasina,1,t3_94rfy3,0,1533687580.0
"If we all report the govt tweets, twitter might automatically remove them, right? Report as spam?",1,t3_94rfy3,0,1533848678.0
Is this still going on?,1,t3_94rfy3,0,1548795077.0
Why you don’t try and reach out to India? They are your neighbors and can easily deploy millions of soldiers and resources to help,1,t3_94rfy3,0,1533504340.0
Tell me name of a good vpn... which is kind of free or at least use it long term without purchasing it. ,1,t3_94rfy3,0,1533502997.0
"What can an Australian do, aside from writing to our sitting members? ",1,t3_94rfy3,0,1533506901.0
What is your goal OP? What are you trying to achieve?,-13,t3_94rfy3,0,1533487815.0
[deleted],0,t3_94rfy3,0,1533504027.0
"My thoughts and prayers are with you buyyou need to understand something why arent the parents of these bothered by this?
Whatever the case if you hate your country we Pakistanis will surely accept with open arms .hey we finally got a pm that cares for people.",-2,t3_94rfy3,0,1533500923.0
"Sorry I would help, but u/Bengaliabroad is spared. 

All jokes aside, thanks for this post.",-13,t3_94rfy3,0,1533484387.0
Ex-wife ui,-1,t3_94rfy3,0,1533506996.0
"Slacktivism, social media exposure and online petitions are not going to help you in any way. It will just foster the illusion of having done something and fill us with a sense of self righteousness. Directly contacting politicians at this stage will only result in apathy without having gained a platform for these incidents on mainstream media first.

You need to contact the South Asian news desks for all the MSM outlets. It needs to gain traction with local reporters and go up the ladder for the respective agencies before they splash it all over their main pages.

Reuters, AFP, BBC, Al-J and the like all have regional subdivisions with local reporters...it’s them who need to be tweeted at, not the organisation at the top level.

Also try non traditional media. These events are bread and butter for the folks behind Vice News, Daily Show, John Oliver, Samantha Bee, Jim Jeffries, The Last Leg with Adam Hills and other socially conscious satirists of their ilk. They may help give you more exposure.

You need momentum in the media before any external politician or political organisation will step up and say anything. Before even talking about the UN or EU, you have your SAARC, GCC and ASEAN closer by who may be persuaded to say something first. 
",-1,t3_94rfy3,0,1533520430.0
[deleted],-23,t3_94rfy3,0,1533483048.0
"We can help by exterminating all white people and keeping this on the hush hush.


Brown people = good. 

We gotta be cultural/moral relativists here, guys. 


They just don’t know better!!! ",-14,t3_94rfy3,0,1533509088.0
"Id like to help but I first need to get over my panic attack that was induced by Trump having 2 scoops of ice cream and him saying ""can i get a coke, please.""

Im sure your problems seem like they matter... but orange man bad, so... you understand.",-4,t3_94rfy3,0,1533524219.0
Is this thing all blown out out of proportion just to push some app? The Astroturfing regarding this situation is looking pretty obvious and capitalizing on tragedy to sell a product is scummy. ,-6,t3_94rfy3,0,1533540662.0
[deleted],-4,t3_94rfy3,0,1533688525.0
"Here's an idea, why don't the people of Bangladesh help the people of Bangladesh instead of begging for white people to",-43,t3_94rfy3,0,1533487651.0
Stop spamming propaganda ,-16,t3_94rfy3,0,1533499562.0
"Oh wow, a Change.org petition, because those have an effect, right?",-5,t3_94rfy3,0,1533518328.0
"Fix iPhone logo hang 
iPhone logo struck fix

https://youtu.be/OXndptc_by8",1,t3_94rfy3,0,1639690636.0
"> other abuse

Thanks for that I will edit the OP!",146,t1_e3n7jg6,1,1533474202.0
What was being reported on Facebook? Looks like it's gone?,29,t1_e3n7jg6,1,1533480815.0
"I'm getting a ""We could not process your request. Please try again later.""",21,t1_e3n7jg6,1,1533474893.0
"I dont get an ""other"" option. The event is still there though.",6,t1_e3n7jg6,1,1533501660.0
"I don't seem to be able to find the ""other abuse"" option. Help! What should I do?",7,t1_e3n7jg6,1,1533514629.0
"This is bread and butter for Vice News, Daily Show, John Oliver, Samantha Bee, Jim Jeffries, The Last Leg with Adam Hills and other socially conscious satirists. Their researchers may help give you more mainstream coverage.

Also, not just the mainstream news organisations, you need to tweet the evidence to their South Asian desks. It needs to go up the chain and it’s the reporters involved with the regional subdivision who will investigate more and push the story. Tweeting the organisation at the top level will have little effect. ",14,t1_e3n8rnf,1,1533516812.0
"Think Musk might be interested? It's not a technology issue, but he seems to like getting involved in world events",79,t1_e3n8rnf,1,1533483178.0
"Hijacking this comment...Anyone else disgusted by the fact that no major news source like CNN, BBC, Washington Post, NY Times etc etc. have this news in their front page? Children are getting brutally beaten to death, young girls are getting raped, and journalist are being censored, detained and beaten as well...what else does it take to get on their front page? 

Maybe they are unaware of it. /s 

I don't know if this will do anything but I urge people to write email to them and ""politely"" I guess urge them to bring this story to the front page.

CNN: [https://edition.cnn.com/feedback](https://edition.cnn.com/feedback)

BBC: [**haveyoursay@bbc.co.uk**](mailto:haveyoursay@bbc.co.uk)

NY Times:  [**tips@nytimes.com**](mailto:tips@nytimes.com)

Huffington Post: [scoops@huffpost.com](mailto:scoops@huffpost.com)",1,t1_e3n8rnf,1,1533523441.0
"Possible improvement on the OP: Find a human rights organization that allows people to donate specifically to human rights violations in Bangladesh, and message OP to add the link.

I checked several human rights organizations, but none seems to allow to donate for violations in a specific country only.",1,t1_e3n8rnf,1,1533569001.0
"Hey mate, thanks for the help, I have ~~added~~ removed it ~~to~~ from the OP

Due to Privacy and safety concerns we now recommend using **Briar**",303,t1_e3n80eu,1,1533476032.0
I would also include Briar for secure communication: [https://briarproject.org/how-it-works.html](https://briarproject.org/how-it-works.html),20,t1_e3n80eu,1,1533485873.0
"I believe the internet has been slowed down to **1.28KBPS,** from what I heard yesterday, though it will be possible to download.",9,t1_e3n80eu,1,1533484858.0
"ShareIt is great for sending apps from one phone to another. Great, underrated stuff. ",6,t1_e3n80eu,1,1533486646.0
"Please consider using Briar instead of FireChat:

**https://web.archive.org/web/20150917061844/https://www.wired.co.uk/news/archive/2014-06/25/firechat**

Multiple people have recommended Briar now:

https://www.reddit.com/r/bangladesh/comments/94rfy3/how_you_can_help_please_read/e3nhpgr/

https://www.reddit.com/r/bangladesh/comments/94rfy3/how_you_can_help_please_read/e3no912/

And discouraged FireChat:

https://www.reddit.com/r/bangladesh/comments/94rfy3/how_you_can_help_please_read/e3nmbgn/",4,t1_e3n80eu,1,1533499023.0
"FireChat isn't a Free Sofware or Open Source.

I would go for [Briar](https://briarproject.org).",7,t1_e3n80eu,1,1533492359.0
"Also Telegram, it's a safe option. ",15,t1_e3n80eu,1,1533475115.0
How does it work? ,1,t1_e3n80eu,1,1533492648.0
Highjacking the top comment to post this [White house petition to Condemn state-sponsored terrorism in Bangladesh](https://petitions.whitehouse.gov/petition/condemn-state-sponsored-terrorism-bangladesh).,1,t1_e3n80eu,1,1533498086.0
"[@banterelsa's latest tweet](https://i.imgur.com/i8ZAFKk.jpg)

[@banterelsa on Twitter](https://twitter.com/banterelsa)

-

^I ^am ^a ^bot ^| ^[feedback](https://www.reddit.com/message/compose/?to=twinkiac)",-9,t1_e3n80eu,1,1533475206.0
"Start tweeting @ Philip Defranco, the guy has made a name for himself in trying to get down to the facts of a story. Something that the mainstream media is trying to keep on the down low is right in his wheelhouse. ",101,t1_e3n6y6q,1,1533484565.0
Perhaps you can start a trend on Twitter to delete Facebook which if it picked up would make facebook have to reconsider it's position of against the people as well as bringing it to light in the news around the world of why millions of users are deleting Facebook.,5,t1_e3n6y6q,1,1533494546.0
We need to raid the page. Post as much sensitive content as possible so the page gets shut down. ,7,t1_e3n6y6q,1,1533496074.0
"Hijacking this comment...Anyone else disgusted by the fact that no major news source like CNN, BBC, Washington Post, NY Times etc etc. have this news in their front page? Children are getting brutally beaten to death, young girls are getting raped, and journalist are being censored, detained and beaten as well...what else does it take to get on their front page? 

Maybe they are unaware of it. /s 

I don't know if this will do anything but I urge people to write email to them and ""politely"" I guess urge them to bring this story to the front page.

CNN: [https://edition.cnn.com/feedback](https://edition.cnn.com/feedback)

BBC: [**haveyoursay@bbc.co.uk**](mailto:haveyoursay@bbc.co.uk)

NY Times:  [**tips@nytimes.com**](mailto:tips@nytimes.com)

Huffington Post: [scoops@huffpost.com](mailto:scoops@huffpost.com)",3,t1_e3n6y6q,1,1533523495.0
[deleted],-2,t1_e3n6y6q,1,1533474398.0
"Thank You for that. I have mentioned news organisations on twitter, they haven't responded yet!",115,t1_e3n7c3s,1,1533473857.0
"Twitter, especially here in the US, seems to be ignoring the #WeWantJustice hashtag. Seems like they are trying to hide this from the media here. Somehow, it is not even in n the top 10. (Some of them getting there with around 2000 tweets. Even thought #WeWantJustice clearly has around or even more than that). I am also trying to spread it around social media over here. ",107,t1_e3n7c3s,1,1533474214.0
Found this on r/popular. Thanks for gilding this and helping me and many others to see this.,16,t1_e3n7c3s,1,1533477851.0
Same. This needs to be everywhere.,7,t1_e3n7c3s,1,1533486667.0
"Support Amnesty International, financially if you can, in other ways if you can't. They can get on the ground and do robust research & interviews, hold corrupt governments and officials to account and produce independent reports that can be used in international courts to evidence human rights abuses and breach of international law. This kind of situation is precisely why that organisation exists.
",1,t1_e3n7c3s,1,1533561053.0
"Yes there is something you can do, contact your representatives in the UK to put pressure on the gov in Bangladesh. ",42,t1_e3n9169,1,1533476226.0
[deleted],18,t1_e3n9169,1,1533481163.0
Protest in Altab Ali Park in East London. ,8,t1_e3n9169,1,1533481197.0
At least get the firechat app,3,t1_e3n9169,1,1533484057.0
"Reported the event and spent some time going through to report as many posts/comments as possible too. If Facebook is gonna be a dick about this and ignore it, I'm going to make it as inconvenient as possible for them",35,t1_e3nfmvc,1,1533488868.0
[deleted],20,t1_e3nfmvc,1,1533487743.0
"Since it’s in Bengali and google translate only does so much, could someone show which part is asking for doxxing so we understand what we’re doing?",15,t1_e3nfmvc,1,1533486124.0
Tell everyone posting updates to change their profile picture to something blank and make most of their settings private. ,15,t1_e3nfmvc,1,1533491687.0
"If you want to contact facebook staff member, you could try emailing ar@fb.com, it's their account receivable department, and I'd guess real humans read those mails. You could also try to identify people working there on linkedin and send them e-mails. The format of their mail adress is either fullname@fb.com or firstname@fb.com.",6,t1_e3nfmvc,1,1533503595.0
Facebook doesn't have a selection in their reporting reasons that allows a comment. I reported real threat of violence. I wasn't sure if that was the best option. ,5,t1_e3nfmvc,1,1533497823.0
"live in the states and know people who work at facebook, trying to see who I can get this forwarded to.",2,t1_e3nfmvc,1,1533525644.0
these people posting doxed accounts literally need to die human scum,2,t1_e3nfmvc,1,1533496677.0
"I have contacted them, but most likely the messages are in the spam folder. ",31,t1_e3n7597,1,1533473877.0
Could you share the link to what you’re trying to report ? ,8,t1_e3n7597,1,1533480984.0
"Every bit of it helps. Thank you for doing that. You can come join us in discord to chat and help out, : https://discord.gg/RNCTj2m 

We also need translators to translate and upload the videos from the archives, if you know anyone who's capable to helping us edit and upload those please let us know. Thank You. ",22,t1_e3n7qy2,1,1533474718.0
"I have the same error issue, also did the same thing.",4,t1_e3n7qy2,1,1533474656.0
What's Sky's email?,1,t1_e3nfyl0,1,1533520655.0
"You did well! Speaking of the UN, here's [a petition for enlisting the BCL as a terrorist group.](https://www.change.org/p/united-nations-enlist-bangladesh-chhatra-league-bcl-as-a-terrorist-organization)",12,t1_e3ndndy,1,1533500969.0
"Might be worth putting out a bot to let people located in Bangladesh know they are being doxxed on Facebook and should change their info and profile pictures to make it as hard to identify them as possible? Just one idea.  As well as letting them know about other safer ways to spread the info, and asking they let others know. (EDIT: And this info? https://www.reddit.com/r/bangladesh/comments/94rfy3/how_you_can_help_please_read/e3ne7f0?utm_source=reddit-android)

Or maybe a bot that recommends pre-generated tweets, Facebook captions, emails to representatives, etc. to spread awareness to the cause that people can just copy and paste? 


Edit 2: Another good idea for info to spread to average Redditors 
https://www.reddit.com/r/bangladesh/comments/94rfy3/how_you_can_help_please_read/e3noqh3?utm_source=reddit-android",10,t1_e3nhd6r,1,1533495477.0
Thank You. I have added it to the OP,5,t1_e3nu0yq,1,1533498234.0
Sorry but do you really think Trumps White House gives a shit what's happening there? ,5,t1_e3nu0yq,1,1533504169.0
but we’d have to go outside ,-8,t1_e3nev2k,1,1533515638.0
"Mate, thats a lot you have done. Thank You!",9,t1_e3ntg4n,1,1533497970.0
"Hi, as another Canadian, who should I write to? ",5,t1_e3npg5t,1,1533504826.0
"It seems that your comment contains 1 or more links that are hard to tap for mobile users. 
I will extend those so they're easier for our sausage fingers to click!


[Here is link number 1](https://en.wikipedia.org/wiki/FireChat#cite_note-technology-33718318-4) - Previous text ""[4]""



----
^Please ^PM ^/u/eganwall ^with ^issues ^or ^feedback! ^| ^[Delete](https://reddit.com/message/compose/?to=FatFingerHelperBot&subject=delete&message=delete%20e3nrw36)
",4,t1_e3nrvrl,1,1533496011.0
Grateful for the opportunity to be able to aid someone plagued by the hellfire that took place over there; Are there any other gofundme's or anything that have been verified?,1,t1_e3savy5,1,1533737932.0
[deleted],13,t1_e3nfy1z,1,1533485045.0
"Yes you can, you can contact your news outlets via email, call , share the story with your friends and family, ask them to share too. ",3,t1_e3nfy1z,1,1533492124.0
"Mate, thank you very much for coming forward. We need translators to translate videos from bangla to english to SRT's so that we can sub them and share them on social media platforms! Please join the discord and pm me your discord username so that I can get you started ASAP!",6,t1_e3nt84w,1,1533497511.0
Beyond awareness raising it's true - better to support an internal advocacy organisation such as Amnesty International - this type of situation is literally why they exist.,2,t1_e3o59ud,1,1533560965.0
">thus leading to more people hating us

This is, ultimately, the justification for every inaction - if it goes wrong, people might hate us.",1,t1_e3ocffs,1,1533567735.0
Why is Facebook removing posts about this?,1,t1_e3nhk85,1,1533524754.0
"You could start here:  https://www.bbc.com/news/world-asia-45074384    and then look at the live thread to see what is happening.  https://www.reddit.com/live/11e4mknpbhjqr   

The corrupt government is brutally trying to suppress demonstrations by students. Many students have been beaten with some women students being raped and some killed by groups asked to do this by the government. The government is going after protesters and anyone using social media to share the truth. They shut down the internet in parts of the country and are telling people that none of this happened.",5,t1_e3nm6wt,1,1533491151.0
"2 students killed by a bus last week, students demand justice and proper road rules and safety stuff, gov gets pissed, pays off thugs to incite violence. 

The thugs, murder, capture, torture & rape students. ",3,t1_e3nm6wt,1,1533493164.0
Thank You for doing this. I will share it with Archive team. ,5,t1_e3o0agd,1,1533505789.0
"Countable - Contact Congress by Countable Corp https://itunes.apple.com/us/app/countable-contact-congress/id893853823?mt=8 

Is also a good app to contact your representatives. ",1,t1_e3oa3n7,1,1533517644.0
"Please do not send money, contact your senator, representative, media personalities, social media influencers,, get the news out to your friends and family, ask them to share with their friends and family and so on. Get people to talk about it. ",24,t1_e3nj1ap,1,1533488369.0
Thank You for getting the word out. ,1,t1_e3ogkp1,1,1533537355.0
"This would be very effective, first get in touch with those retailers, ask them to issue a condemn against the atrocities of the gov, if they do not do that, then we boycott",1,t1_e3omkd9,1,1533537208.0
He’s an independent journalist but Shaun King (@shaunking) has a strong reputation for covering issues like this and has a very large internet following ,1,t1_e3p2pq5,1,1533644454.0
"Like I have been telling people since yesterday, even if you have spoken about it with one person, you are spreading that info to another person, every little bit helps. 

Insignificance of the country is not a matter here, rn the students aren't fighting as Bangladeshis, they are fighting as students for students with a dictatorship. ( *or atleast thats how I see it* )

I am sorry for a delayed reply, and once again, thank you. ",3,t1_e3pmfaa,1,1533582053.0
[deleted],-18,t1_e3ni0xz,1,1533488376.0
"You could start here:  https://www.bbc.com/news/world-asia-45074384    and then look at the live thread to see what is happening.  https://www.reddit.com/live/11e4mknpbhjqr   

The corrupt government is brutally trying to suppress demonstrations by students. Many students have been beaten with some women students being raped and some killed by groups asked to do this by the government. ",4,t1_e3nlmyt,1,1533491055.0
"2 students killed by a bus last week, students demand justice and proper road rules and safety stuff, gov gets pissed, pays off thugs to incite violence. 

The thugs, murder, capture, torture & rape students. ",5,t1_e3nlmyt,1,1533493160.0
Might as well,1,t1_e3ofni3,1,1533527047.0
"Thank you for the gesture, but we are asking people to not donate any money at this time since that has the opportunity to be misused. We have instead setup a privacy hotline to share with people to make it easier for the to safely record and post videos and images. ",1,t1_e3omgnn,1,1533537302.0
"Mate, please do share that info with us. If she needs more info please direct her to the reddit live thread! ",1,t1_e3p12nm,1,1533556387.0
"and now they're using a different template

    #Bangladesh govt agreed to fulfill 9 point demand raised by demonstrating 
    school students’ #saferoadsforall movement, yet disguised #BNPJamaat
    activists attacked @albd1971 office spreading #fakenews
    #WeWantJustice
    @BBCNews @bbcbangla @cnni @MailOnline @AFP @AlJazeera",2,t1_e3p6c9c,1,1533561595.0
We have abandoned that. We have switched,2,t1_e3p6c9c,1,1533562734.0
"You can also do [this](https://www.reddit.com/r/bangladesh/comments/94rfy3/how_you_can_help_please_read/e3p2pq5/)

If you do nothave a social media account you can share it with ur friends and family who do, and ask them to tweet/share it",1,t1_e3pbe7c,1,1533572709.0
Join the discord server. The translators are there. ,1,t1_e3q6mye,1,1533593494.0
"They've put up a gofundme @ https://www.gofundme.com/bangladesh-victim039s-fund to help the treatment of students who are severely injured and unable to meet their medical expenses. 

This info is also up @ the live thread.  Please help and share, if you can?",1,t1_e3qr9po,1,1533676235.0
https://discord.gg/tNH9tvD   is a new link.,2,t1_e3nh8ho,1,1533490696.0
2018 in a nutshell,2,t1_e3o229r,1,1533506687.0
You must have made a typo - antifa is _against_ the murdering fascists.,3,t1_e3nsff9,1,1533518040.0
beating and raping protestors calling for safer roads is the exact same as shutting down a Nazi rally,7,t1_e3nsff9,1,1533505196.0
"Antifa is an organisation that opposes fascism. 

Antifa is an anarchist organisation, i.e one that opposes the existence of a state, let alone an authoritarian one.

Get some faxx bro.",6,t1_e3nsff9,1,1533506045.0
Yep. ,1,t1_e3nsff9,1,1533497309.0
"Antifa are the good guys.

BCL are their Nazis.",1,t1_e3nsff9,1,1533567976.0
A member of our team will have contacted you! ,1,t1_e3odilk,1,1533537530.0
"Edit 4, #WeDemandJustice is already up there",1,t1_e3opqq6,1,1533537151.0
"You can ask them to share that with their friends and family, ask them to get in touch with the emabassies in Dhaka, share those pictures with us so that we too can share it with the rest the world, to show that even during such bleak times, we stand together! ",1,t1_e3org2k,1,1533537122.0
"Thanks for that, Ive linked it in OP",1,t1_e3orq4y,1,1533537052.0
Yes we actively need translators (translate videos from Bangla to english and compile an SRT) and editors (to hardcode the SRT file in videos and upload them),1,t1_e3os5mg,1,1533536775.0
"Both, news media outlets and politicans!",1,t1_e3ot227,1,1533537581.0
"~~I think they tried to but the popo dispersed them!~~

edit: they didnt. ",1,t1_e3owf8i,1,1533572803.0
"The #wedemandjustice is inactive. It has changed to #RebootBangladesh
",1,t1_e3oyemi,1,1533549581.0
Please help spread new tag #RebootBangladesh!! Almost no one is using it on twit and the others are obviously blocked because if they weren’t they’d be trending right now,1,t1_e3oyemi,1,1533549691.0
If you’ve got a twitter account... and you’ve got time... spread the #RebootBangladesh tag? I’m lonely on there ,1,t1_e3p0j11,1,1533552336.0
"Thank You for all you have done. You can also help by doing [this](https://www.reddit.com/r/bangladesh/comments/94rfy3/how_you_can_help_please_read/e3p2pq5/)

If you do not have a social media account you can share it with ur friends and family who do, and ask them to tweet/share it",1,t1_e3p0j11,1,1533572758.0
Check Edit #7. That has inctructions for European members,2,t1_e3p1liw,1,1533556672.0
"You can also help by doing [this](https://www.reddit.com/r/bangladesh/comments/94rfy3/how_you_can_help_please_read/e3p2pq5/)

If you do not have a social media account you can share it with ur friends and family who do, and ask them to tweet/share it",2,t1_e3p1liw,1,1533572737.0
https://www.reddit.com/r/bangladesh/comments/94rfy3/how_you_can_help_please_read/e3p2pq5/,1,t1_e3pij9p,1,1533572649.0
You can join us on Discord : https://discord.gg/NX6Ybq7,1,t1_e3pij9p,1,1533586269.0
"It's been deleted. 
The page itself has been deleted. 
We are uploading a mirror",1,t1_e3qt64u,1,1533621034.0
"Posting it in the live updates. Sorry for the delay!

Update: He wasnt arrested, the police took a statement from him. ",2,t1_e3rwo2k,1,1533666375.0
Calm down will ya? ,1,t1_e3so0tb,1,1533709189.0
In 2021 it started again.,1,t1_efan18u,1,1641312094.0
Protonvpn works great. ,2,t1_e3nz3uy,1,1533503180.0
Write to the UN ,2,t1_e3o338n,1,1533516878.0
"Our goal, initially was, to get the government of Bangladesh to change the driving regulations and laws surrounding it so that the students can travel safely and peacefully. 

What started out as a peaceful protest turned into an ugly fight, where school students as young as 14 are being rapes, tortured and murdered. this has been going on for >4 days now. 

The extremist wing of the government aka the gov it self is supporting these actions, by inciting violence, paying ppl to dress up as students and join the protest, incite violence and so on. ",12,t1_e3njnhr,1,1533493002.0
[deleted],0,t1_e3o05ij,1,1533504129.0
Congrats on IK. I celebrated with my Paki friends that day. The parent's are bothered but what can they do? ,2,t1_e3nwwkn,1,1533502343.0
"> thoughts and prayers

gonna need more than that.
",0,t1_e3nwwkn,1,1533515870.0
