Comment Text,Comment Score,Parent Comment ID,Comment Depth,Created Timestamp
">Where is the iPhone client? Terrible idea.

Blame Apple for not wanting an actually secure mesh messaging system on their platform. :)

It definitely ISN'T a terrible idea to use a more secure client between Android phones and avoid using FireChat as much as it makes sense, but no further. I didn't say to ignore it entirely. My point: Briar ought to get a lot more encouragement than FireChat and that people who point out FireChat should also point out the security risks associated with it, and to neglect doing so seems like an actually terrible idea.

Edit:
The original post I replied to only read ""Where is the iPhone client? Terrible idea."", and I replied to that alone. I'll post a second, separate reply.
",2,t1_e3o3azt,3,1533507390.0
">Also, the risk detailed in the article

Which ones exactly do you mean?

>still holds true for other FOSS applications.

1. You likely didn't intend it, but the way you wrote that sentence, it implies that FireChat is FOSS (Free Open Source Software). It's not, it is proprietary software, Briar is not.

2. Let me go over the issues addressed in the article one by one:

>>However, an individual within one of the mesh networks could easily snoop on nearby users' discussions because all conversations are conducted in open chatrooms.

This doesn't hold true for Briar, Mesh network traffic is already encrypted.

>What's more, the app does not facilitate private, one-to-one messaging and also doesn't use any kind of encryption to protect messages in transmission. 

This doesn't hold true for Briar, everything is encrypted.

>It doesn't change anything, the governemnt can access them as well. 
That sounds like [FUD](https://en.wikipedia.org/wiki/Fear,_uncertainty_and_doubt). The government almost certainly CAN'T access anything written via Briar.

>Assuming Google will not sentence many people to death

...seriously? Wind down your hyperdramatic rhetoric a bit, please.

Assuming Google will not sentence many people to death, it's an absolutely terrible idea to switch to something that doesn't work on both Android and iOS.

>it's an absolutely terrible idea to switch to something that doesn't work on both Android and iOS.

No, it isn't.",2,t1_e3o3azt,3,1533508024.0
"**Mesh networking**

A mesh network (or simply Meshnet) is a local network topology in which the infrastructure nodes (i.e. bridges, switches and other infrastructure devices) connect directly, dynamically and non-hierarchically to as many other nodes as possible and cooperate with one another to efficiently route data from/to clients. This lack of dependency on one node allows for every node to participate in the relay of information. Mesh networks dynamically self-organize and self-configure, which can reduce installation overhead.

***

^[ [^PM](https://www.reddit.com/message/compose?to=kittens_from_space) ^| [^Exclude ^me](https://reddit.com/message/compose?to=WikiTextBot&message=Excludeme&subject=Excludeme) ^| [^Exclude ^from ^subreddit](https://np.reddit.com/r/bangladesh/about/banned) ^| [^FAQ ^/ ^Information](https://np.reddit.com/r/WikiTextBot/wiki/index) ^| [^Source](https://github.com/kittenswolf/WikiTextBot)   ^]
^Downvote ^to ^remove ^| ^v0.28",60,t1_e3ncrrr,3,1533480687.0
"I didn't think about that, thanks for pointing that out. ",3,t1_e3ncrrr,3,1533490347.0
What is wrong with telegram?,3,t1_e3ngvk4,3,1533489545.0
"Neither Signal nor Telegram do anyone any good if their access to data service is cut off.  What people are recommending here are mesh network apps - apps that connect cell phones to each other and relay messages through them, so all they require is that a bunch of cell phones be close enough to at least one other on the mesh, and they can message anyone else connected to that same web of connections.  Mesh networking doesn't rely on having access to the Internet, that's the whole point here.",3,t1_e3ngvk4,3,1533516426.0
"Defranco picked up the story in his episode today! It will be interesting to see whether or not Facebook and YouTube try to bury the video, seeing as this is a reasonably prominent Youtuber we're talking about here",1,t1_e3nrv1u,3,1533595948.0
[deleted],-15,t1_e3n7wjs,3,1533474687.0
"Can someone help me understand how a government can censor a hashtag or any form of communication by a private organization like twitter or Facebook? 

All of this is so horrible. ",39,t1_e3n82pv,3,1533483134.0
Ok! Thank you. Will spread the new hashtag then.,22,t1_e3n82pv,3,1533475930.0
"Apparently these tags have also been censored, new one appears to be #RebootBangladesh",2,t1_e3n82pv,3,1533620016.0
"It seems like this happens all the time and everytime we think were past it, it comes back. What is going to happen to the Bangladesh government. What will replace it. ",2,t1_e3nh394,3,1533516999.0
The group is down,19,t1_e3ndsyo,3,1533483908.0
Very true. I edited my post with another recommendation as well. I think though it would make a difference just finding a handful of people in Bangladesh who can then private message their friends / family on Facebook so that the information spreads. ,1,t1_e3nrhtk,3,1533496141.0
"Yes, it is. If the white house does not respond that will have a huge global impact on the US foreign image. It's embarrassing that the petition won't mean anything. We Americans want to help but don't expect much from our derelict government. ",1,t1_e3obo1f,3,1533520757.0
Thanks a lot. Just sent both letters now.,2,t1_e3qsk3p,3,1533621550.0
"Thank you for your quick response! Unfortunately you're correct, there are a lot of scummy people that come out of the woodwork and try to take advantage of situations like these. /:",1,t1_e3ts7yo,3,1533740503.0
"Ok, thank you",1,t1_e3rb36h,3,1533644970.0
"Hey man, thanks for getting back to me about it, please update me with the linksm once its been run. 

#Thank You very much 

Dont worry about being late, we all have stuff ot do :) ",1,t1_e3pzfls,3,1533587419.0
">Here they are splitting heads open of peaceful protesters on their knees.  
>  
>[http://www.berkeleyside.com/2017/05/26/eric-clanton-charged-four-counts-assault-deadly-weapon](http://www.berkeleyside.com/2017/05/26/eric-clanton-charged-four-counts-assault-deadly-weapon)

According to that source:

>This case arises in the context of a demonstration by a group of loosely described out-of-town, right wingers… who uttered racist and homophobic comments and engaged in pushing and shoving

1. It was one person, not ""they""
2. It doesn't say he was found guilty
3. The protesters weren't peaceful

>[https://gfycat.com/ThatGaseousCurlew](https://gfycat.com/ThatGaseousCurlew)

The person attacked on this link wasn't an innocent bystander. He acted visibly hostile and I'm personally not surprised he was attacked.

Please, keep this nonsense in a single comment thread, instead of copypasting it to multiple places - this reddit post is about Bangladesh.",1,t1_e3p06lu,3,1533568544.0
birds of a feather flock together,3,t1_e3obhlq,3,1533516720.0
people like you are the ones out raping protestors,3,t1_e3obn71,3,1533516760.0
"Yeah man look, I'm not gonna believe your bs gifs or whatever. 

Antifa isn't fascist. 

Saying black people deserve a peaceful genocide or whatever, is fascist, it's great that they shut down Berkley.",2,t1_e3p05ap,3,1533555760.0
"Gimme some of your soy bitch, fore I get the BB after ya.",0,t1_e3obo64,3,1533516903.0
"Congrats on getting a PM that cares. No worries, do update me hwere when you are at home. ",1,t1_e3otaio,3,1533537768.0
"its being blocked by twitter, arabic version of it is also being blocked by twitter ",1,t1_e3owwss,3,1533545271.0
"No worrie, mistakes happen. ",1,t1_e3pmmcv,3,1533576224.0
haha.. by any means. as if thats gonna stop them lol,1,t1_e3pjud8,3,1533574631.0
"omg dude. i am sorry, I am tired. i will change that!",1,t1_e3ozark,3,1533550299.0
Thank you!,1,t1_e3pkfzm,3,1533574663.0
"Mate, don't politicize this thread. we all know neither BNP or AWML is good for this country. Both are borderline terrorist organizations! Keep politics out of this. ",5,t1_e3nr5ii,3,1533497421.0
"> you must be really busy managing this important post.

I am not sure whether you r being sarcastic or genuinely thanking me. I am gonna go with the latter

I am gonna PM you with how to move forward with this.",1,t1_e3othp8,3,1533538999.0
Sorry I thought I could reason with you dumbfucks. My bad.,3,t1_e3nhmb4,3,1533486181.0
"These are people trying to draw as much attention as possible to the fact, that they could be killed any second by a government, simply because they try to have basic human rights. That's the exact opposite of propaganda. Where are you from, if I may ask? ",10,t1_e3nw7fu,3,1533500732.0
1 in 5 posts because it's a big fucking deal...how about you stop being a piece of shit for condemning people for asking for help,13,t1_e3nw7fu,3,1533500452.0
electric iron man suit,21,t1_e3nj7zk,4,1533488045.0
Leaked Iron Man 4 plot,11,t1_e3nj7zk,4,1533490187.0
"That would be pretty cool, even if it's probably a bad idea. ",1,t1_e3nj7zk,4,1533577303.0
He'll probably just call one of the students a pedo,14,t1_e3nhr71,4,1533517715.0
Elon Musk set us all up to see him as a heroic figure set to usher in the future and then stupidly revealed his true colors in the past few months or so.,1,t1_e3o71xx,4,1533517784.0
Elon Musk set us all up to see him as a heroic figure set to usher in the future and then stupidly revealed his true colors in the past few months or so.,1,t1_e3o71xx,4,1533517877.0
"You have a point, his actions are usually generally helpful and that’s great. His attitude when he’s proven wrong or put up to debate just stinks. I guess one doesn’t have to like a guy to recognise the good he does.",5,t1_e3oe5mt,4,1533518941.0
"But between firechat and briar (both of which are unknown and offline), better pick the best one. And security wise, briar seems to be the best.",33,t1_e3nvbdl,4,1533500690.0
The developer [literally claimed that it shouldn't be used for these purposes](https://en.wikipedia.org/wiki/FireChat#Security).,1,t1_e3nvbdl,4,1533582545.0
"My comment was a quote, best to argue with the original poster as it is his vision. All I want is for people to know their options before deciding :)",1,t1_e3nvbdl,4,1533515352.0
What can us Americans do to help out? Would it be worth boycotting companies like Facebook and YouTube or even posting it on our accounts as it's unlikely the Bangladesh government would have our accounts removed?,37,t1_e3nmheg,4,1533493344.0
Also found this [change.org](https://change.org) petition: [https://www.change.org/p/united-nations-enlist-bangladesh-chhatra-league-bcl-as-a-terrorist-organization](https://www.change.org/p/united-nations-enlist-bangladesh-chhatra-league-bcl-as-a-terrorist-organization),3,t1_e3nmheg,4,1533516032.0
Got it. Thanks for the reply. ,1,t1_e3nmheg,4,1533514403.0
You double posted. ,1,t1_e3nmqku,4,1533576963.0
"**Fear, uncertainty and doubt**

Fear, uncertainty and doubt (often shortened to FUD) is a disinformation strategy used in sales, marketing, public relations, politics, cults, and propaganda. FUD is generally a strategy to influence perception by disseminating negative and dubious or false information and a manifestation of the appeal to fear.

While the phrase dates to at least the early 20th century, the present common usage of disinformation related to software, hardware and technology industries generally appeared in the 1970s to describe disinformation in the computer hardware industry, and has since been used more broadly.

***

^[ [^PM](https://www.reddit.com/message/compose?to=kittens_from_space) ^| [^Exclude ^me](https://reddit.com/message/compose?to=WikiTextBot&message=Excludeme&subject=Excludeme) ^| [^Exclude ^from ^subreddit](https://np.reddit.com/r/bangladesh/about/banned) ^| [^FAQ ^/ ^Information](https://np.reddit.com/r/WikiTextBot/wiki/index) ^| [^Source](https://github.com/kittenswolf/WikiTextBot)   ^]
^Downvote ^to ^remove ^| ^v0.28",1,t1_e3o465x,4,1533508030.0
Good bot,16,t1_e3ncs5t,4,1533486701.0
"Telegram does not use End to End encryption as a standard - you have to manually start it by using the private chat function. The transport laEr encryption used for regular messages cannot be trusted if you control a large enough part of the connection process. Many users are not aware of this problem.        
Furthermore the encryption algorithm itself is not thoroughly known. We know from German and British law enforcement files that at least their respective agencies were able to hack it.           
Last but not least Telegram can be completly ""taken over"" by a so called BGP attack, although for a limited time only- which was done recently by Iran. (See here for the BGP hack:  https://www.cyberscoop.com/telegram-iran-bgp-hijacking/) ",4,t1_e3nld5t,4,1533499253.0
"Absolutely, Mesh networking makes sense. But you still should have a safe messaging app when you are not close enough to the mesh to use it (e.g. because you are at home) or when communicating with the outside world. ",1,t1_e3oc0nh,4,1533536702.0
There's a difference in censorship and protection of private information.,12,t1_e3n7zdu,4,1533478962.0
"I know for instagram at least, it is instagram itself blocking hashtags.  They went through a whole thing a few weeks ago blocking any and every form of #stripper they could find.  I assume twitter would be doing the same thing.  ",8,t1_e3nf21s,4,1533487998.0
"Easy, Twitter and Facebook have a lot of users in the nation and region as a whole if they cause issues for the government they get banned and loose all that revenue so they'd rather bend to the government then risk having less revenue cause they took a stand. ",4,t1_e3nf21s,4,1533493631.0
"Bots mostly done aside from Reddit limitations so it can only pull a user every 2 seconds, so I'll have to implement threading tomorrow to make it work.",1,t1_e3ns0r4,4,1533507445.0
"> It was one person, not ""they""

I can give you countless examples, it is not one person, but their policy of assaulting anyone right wing.

> It doesn't say he was found guilty

He is on video, and they have his outfit. Are you always this willfully ignorant?

> The protesters weren't peaceful

On your knees speaking. How could one BE more peaceful? You do not get to silence ANY speech with violence, you fucking fascist apologist. 

> The person attacked on this link wasn't an innocent bystander.

Are you serious? He was walking past when antifa threw bottles at him, and he turned around to confront being assaulted, and more assault occurred.

>  this reddit post is about Bangladesh.

And the world looks to the USA, as always. When we allow domestic terrorists like Antifa to exist, and assault countless innocents, of course other countries are going to think it is ok. ",1,t1_e3pdxfp,4,1533580103.0
just like all leftist are retards the reeeeee at trump?,1,t1_e3ocaqb,4,1533518606.0
"How much is Soros paying you? $15/hr?

Fucking soyboy twig.",0,t1_e3occ2f,4,1533517346.0
"> Yeah man look, I'm not gonna believe your bs gifs or whatever.

Ya, video, court charges, all BS. 

BE MORE FUCKING IGNORANT. ",1,t1_e3p2jra,4,1533562995.0
You’re a twig.,1,t1_e3ocgur,4,1533517313.0
"I surely will, and thank you so much. It's a much needed change, hope he sticks to his words.",1,t1_e3ote61,4,1533537824.0
Yeah time for a new one...,1,t1_e3ox6zc,4,1533545415.0
[deleted],2,t1_e3pmvex,4,1533576536.0
The Bangladeshi student protesters are the bravest youth I've ever seen. ,1,t1_e3pkz9v,4,1533575121.0
It’s probably good to yell it somewhere so people see haha! So little activity in that tag right now,1,t1_e3ozk4z,4,1533550507.0
"Aye, no problem. It's been a long 3 days ",1,t1_e3ozk4z,4,1533551216.0
"Absolutely no sarcasm whatsoever and I apologise if it came out that way.

I await your PM.",1,t1_e3ou2dl,4,1533539166.0
"I put in /s, my man. Shows that i was sarcastic and not sincere about that statement.",5,t1_e3ni0ea,4,1533486700.0
Guess recognizing sarcasm isn’t your strong suit ,4,t1_e3ni0ea,4,1533486818.0
I believe the best thing to do is to raise awareness! Spread the news over social media and contact news organizations if possible! ,30,t1_e3np7yp,5,1533493872.0
America gives currently more than $100 million aid to bangladesh goverment. Start asking your representative to act on this with implying that.,2,t1_e3np7yp,5,1533537376.0
Good human.,7,t1_e3niizj,5,1533486706.0
"well that’s just ultra shitty.

r/latestagecapitalism at its finest. ",3,t1_e3npicd,5,1533498936.0
"I can hear what you're saying, and I disagree with that.

If there is anyone else with any clarifying questions, feel free to ask them.",1,t1_e3prjue,5,1533608621.0
"I'm a stick that fell from a tree ?

You couldn't come up with a better insult with your oh-so-superior white mind ?",0,t1_e3ocuog,5,1533518523.0
Suggestions? ,1,t1_e3ox9gj,5,1533545623.0
If you’re not in the discord please get in the discord lol ,1,t1_e3pn98g,5,1533578048.0
"They are. They knew what was going to happen to them, they anticipated it, they had it in the backs of their minds all along, yet they went ahead. At this point I feel like they are much more qualified to be the road safety minister than the current asswipe sitting there",1,t1_e3pljax,5,1533575319.0
"I'm so shocked by what's going on. On one hand, the govt is asking for peace, and on the other it's cops and thugs are still at it shooting at, teargassing, and beating up students. The hypocrisy is astounding. ",1,t1_e3ozno7,5,1533551339.0
Didn't know what that meant and assumed a typo. Apologies.,6,t1_e3niiyi,5,1533487264.0
Yes thats the absolute best thing that can be done. ,19,t1_e3npqy4,6,1533495585.0
"Yes, the best thing to do is raise awareness. I am from California, United States here and I am constantly tweeting the best I can at the moment with #WeDemandJustice, because #WeWantJustice has been censored. It is terrible that these posts are to be ignored. When there is hardcore proof and people just scroll on by. Anything helps.",11,t1_e3npqy4,6,1533501546.0
If you don't want it to be that way then you have to delete and block the sites as they loose more revenue when people stop using the site because of them following the government not the people.,2,t1_e3nutcg,6,1533503392.0
"These sites ask for reasons why you delete your account. If hundreds of people delete their accounts and give this as the reason, then maybe they wouldn’t keep doing this shit. It is our job to hold these companies accountable for their actions! As the consumers we have the ultimate power! It’s about fucking time we started using it! I wish I had accounts on Facebook and Twitter just for this purpose. We need to stop complaining and start doing something! (Not attacking you personally, just stating my opinion)",1,t1_e3nutcg,6,1533517413.0
No one would ever ask someone as ignorant as you to clarify shit. ,1,t1_e3qmxqd,6,1533638931.0
I’m hilariously bad at pr/comms... what’s something catchy or mysterious we could use? ,1,t1_e3oxd04,6,1533545818.0
:( we can only do what we can to help as well... it all feels so futile from far away but don’t lose hope!!,1,t1_e3p02cx,6,1533552088.0
"It's all good, bondhu :)",4,t1_e3nj34w,6,1533487419.0
WeDemandJustice is now being censored,7,t1_e3nxka8,7,1533507005.0
"Thankfully, I deleted my social media years ago. Haven’t looked back!",1,t1_e3nzili,7,1533518849.0
"Smugly, I don’t have any social media anymore. I deleted years ago and it was incredibly liberating. ",2,t1_e3ocy1j,7,1533518782.0
I can hear what you're saying. 😀,1,t1_e3r6z92,7,1533731687.0
"We have one, #rebootbangladesh. updated OP",1,t1_e3oxg8t,7,1533546267.0
"**“Hope” is the thing with feathers** - *Emily Dickinson*

“Hope” is the thing with feathers 

That perches in the soul 

And sings the tune without the words 

And never stops - at all 

And sweetest - in the Gale - is heard 

And sore must be the storm 

That could abash the little Bird

That kept so many warm 

I’ve heard it in the chillest land 

And on the strangest Sea 


Yet - never - in Extremity,

It asked a crumb - of me.
",1,t1_e3p0geu,7,1533555650.0
That’s great! ,1,t1_e3oe8nr,8,1533599744.0
"I’ll try @ people using the old tags, hopefully this one works, thank you",1,t1_e3oxnpe,8,1533547012.0
