Comment Text,Comment Score,Parent Comment ID,Comment Depth,Created Timestamp
"For anyone trying to report this on Facebook: select ""other abuse"". That will allow you to report content that you are blocked from seeing and provide a link. ",486,t3_94rfy3,0,1533474041.0
"I would also suggest those that live overseas, identify media personalities and influencers that will most likely care about these causes, and compile a list. Message those people on the list, as opposed to messaging organisations. All it takes is 2-3/100 influencers and the ball will start running",208,t3_94rfy3,0,1533475792.0
"There's an app called FireChat that will allow people to communicate off-the-grid, but they'll have to be quick and download it before Internet gets shut down:
https://twitter.com/banterelsa/status/1025853918125977601?s=19",810,t3_94rfy3,0,1533474729.0
"Please use this thread if you know of any way people can help (like contacting certain media/news, sending out on twitter the stories with a hashtag, etc.).  

Please share your ideas on what people can do.  And ask if you need help.  We can also repost requests for help from the Live Feed to here.  

Live thread link:  https://www.reddit.com/live/11e4mknpbhjqr",128,t3_94rfy3,0,1533473183.0
"Gilded to help boost OP's post.

I highly recommend Twitter - organisations and high profiles generally tend to be more responsive there. @tag relevant people and companies  (including @Facebook on Twitter) who might be able to help. Link credible sources or at least OP's post to help get more on board.",393,t3_94rfy3,0,1533473727.0
"copied and pasted from the r/worldnews thread:

Passing on a comment I saw in an earlier thread about this, if you're in the affected area and have the resources, look into building a [meshnet](https://projectmeshnet.github.io/) so you can keep communication open. I'm sorry I can't do anything else, and it won't calm the civil unrest but at least you can keep communicating. Stay safe. Here's some more links:

whitepaper on meshnets:

https://github.com/McL0v1n/HyperMesh/blob/master/HyperMesh.pdf

meshnet subreddits including the most stable meshnet provider right now:

https://old.reddit.com/r/hyperboria/

https://old.reddit.com/r/Meshnet/

https://old.reddit.com/r/DarkNetPlan/

documentation for hyperboria

https://docs.meshwith.me/

let me know if there's anything I can do in the UK. ",93,t3_94rfy3,0,1533476146.0
Please report this facebook event - they are listing account information to doxx people. https://www.facebook.com/events/467958480345305/?active_tab=discussion,211,t3_94rfy3,0,1533483756.0
Can we not contact with the group admins and tell them to remove the post? ,41,t3_94rfy3,0,1533473441.0
I tried to send a report but was given an error message. Instead I went to the group and reported the group for violence. Hope it helps.,32,t3_94rfy3,0,1533474351.0
"There is a french ISP that provides ""free"" internet access using RTC (56k) - you still need to pay the cost of the phone call

You only need a working landline and a modem

>     dial +33 860 46 99 88 or +33 172 89 01 50
>     Login: toto || Password: toto 

https://www.fdn.fr/services/rtc/",76,t3_94rfy3,0,1533482222.0
"In UK I just checked and a popular news site Sky News doesn't have a story on this as of yet.

I have emailed their news team with a digest version and linked the Live Reddit thread as well so they could see it for themselves.

If anyone else is up for the task, blow up Sky's team to pressure to report on this.

Plus, blow up your own country's news teams so they would feel some pressure to get on top of this .

The more the word spreads, the more outrage it generates and even lay non-reddit people will start to talk about it. Which should in turn draw attention from politicians and support agencies.

Many, very many people have no idea this is happening.

Update: checked 5 hours later and still nothing.",48,t3_94rfy3,0,1533484101.0
[deleted],39,t3_94rfy3,0,1533481624.0
"Hi, I wanted to help, but wasn't sure how other than spreading awareness, so I made a bot to message people who've commented on a 25 top hourly post about what's going on, this is said bot, if you have any questions / ideas for what else I should / could do with a bot tell me.",35,t3_94rfy3,0,1533485522.0
[White house petition to Condemn state-sponsored terrorism in Bangladesh](https://petitions.whitehouse.gov/petition/condemn-state-sponsored-terrorism-bangladesh),17,t3_94rfy3,0,1533498134.0
Let’s protest at Bangladesh consulates in our home countries,42,t3_94rfy3,0,1533482926.0
"I feel kind of worthless on this one, but I really want to help. I tweeted my House Rep and my Senators (I'm American and know nobody in Bangladesh), asking what their plans of action are and how they intend to handle PM Sheikh Hasina, but that's all I can really do. And that feels like nothing. I will keep myself glued to this situation and will continue to help in my way I can. ",12,t3_94rfy3,0,1533497558.0
"A friend who works for facebook sent me this:


>Looks like it has already been raised internally this morning a couple times but I added more detail that I could find. One group has either been disbanded or shut down already, I found another that was still active that I've flagged. Our community integrity and public policy teams are looking into it further. I know both of those teams and will follow up.

Edit: Additional info

>I've flagged that as well. [Event doxxing people.] Reported both, in the case of the event there's an option for saying it has potential for real-world violence. I've escalated it within the company but I do know it's already been reported for that reason. As a side note, ""real world violence"" reasons will be what gets stuff like this taken off the site. Doxxing is trickier because they seem to be smart enough to not include address, phone number, etc. on the FB pages. Taking a look at reporting private groups, I'm not actually sure how that's handled by reports from outside it. Unfortunately little we can do about direct messages.",26,t3_94rfy3,0,1533483887.0
"I cannot say what effect it will have, but this Canadian has written to both my Member of Parliament and the federal Minister of Foreign Affairs urging them to condemn the criminal violence being perpetrated against the students in your country and assert whatever pressure they can to stop it. 

I wish you the best of luck and express my deep respect for your courage in the face of this brutality. I earnestly hope that the sacrifices you make today will earn a better future for your country. 

",12,t3_94rfy3,0,1533493569.0
"In June 2014, Firechat's developers told [*Wired*](https://en.wikipedia.org/wiki/Wired_(magazine)) that ""\[p\]eople need to understand that this is not a tool to communicate anything that would put them in a harmful situation if it were to be discovered by somebody who's hostile ... It was not meant for secure or private communications.""[\[15\]](https://en.wikipedia.org/wiki/FireChat#cite_note-15) 

As of July 2015, FireChat claims to use [end-to-end encryption](https://en.wikipedia.org/wiki/End-to-end_encryption) to protect its one-to-one private messages.[\[4\]](https://en.wikipedia.org/wiki/FireChat#cite_note-technology-33718318-4) 

YEAH I wouldn't use this. They can claim encryption but if the devs said that the app was originally not meant to be a secure communication app for situations such as this then its a very risky thing to use if your in Bangladesh.",10,t3_94rfy3,0,1533496003.0
"NSU student Ashraful Islam Akib was severely injured in the protest and needs financial help. You can help the family here - https://www.gofundme.com/bangladesh-victim039s-fund

If you are in Bangladesh, you can help by sending money here - 
Dutch Bangla Bank Ltd., Panthapath branch
Nasima Islam
A/C no. - 2551516850
Brac Bank
Lutfun Nahar
A/C no. - 1537201635946001

All this information has been verified and the money is going to the family. ",1,t3_94rfy3,0,1533675439.0
"Recommend adding these explicit ""ways to help"" so redditors can help elevate the issue!

1. UPVOTE the [LIVE Bangladesh Protest Crisis thread](https://www.reddit.com/r/live/comments/94mjaw/bangladesh_protest_crisis/)
2. Sign [THE PETITION at Change.org.](https://www.change.org/p/united-nations-we-want-justice-human-rights-violence-happened-in-bangladesh)

EDIT:

3.  Sign [ANOTHER PETITION at WeThePeople](https://petitions.whitehouse.gov/petition/condemn-state-sponsored-terrorism-bangladesh)",8,t3_94rfy3,0,1533492855.0
"I never use social media, is there something else I can do? I sadly cant be a translator either.",17,t3_94rfy3,0,1533484085.0
"As an open alternative to FireChat there is [Briar](https://briarproject.org/), available from the [F-Droid store](https://briarproject.org/fdroid.html), [Google Play store](https://play.google.com/store/apps/details?id=org.briarproject.briar.android), and as [an APK](https://briarproject.org/apk.html). I hope this can be of use to someone and I wish everyone affected by these events well. And don't worry, the world is certainly watching. ",8,t3_94rfy3,0,1533495298.0
Discord is growing,15,t3_94rfy3,0,1533482430.0
"Hi, I'm a Bangladeshi American and I'd like to help any way that I can. I can be a translator for spoken Bangla but unfortunately I cant read it or write it. Please let me know if there is anything I can do. I have posted the BBC article to my Facebook page and am spamming the Facebook pages of news companies but I'm not sure how much its helping as they get marked ""unrelevant"" and more or less disappear. Feel free to send me a personal message. I will do whatever I can. Stay safe out there brothers and sisters. ",6,t3_94rfy3,0,1533497339.0
"Apparently change.org doesn't actually help much. I think most of the change comes from media and public pressure, so I suppose the live thread would be much more useful.

Someone fact check me on this.",6,t3_94rfy3,0,1533509165.0
"Dont use NordVPN. That company is full of scammers. 

",7,t3_94rfy3,0,1533510285.0
"Just FYI, on Edit 2, you're still telling people to download Firechat. Should probably update that to Briar as well.",5,t3_94rfy3,0,1533513420.0
"Ok so personally I don’t think the US should be meddling in Bangladesh situation. I feel like this needs to be resolved diplomatically by the G13 nations and an action must be taken accordingly. We can’t have just the US going in. This is a extremely delicate matter that needs to be again handlers by the UN’s human rights violation protectors, or else it would lead to a eventual country de stabilization thus leading to more people hating us. On the other hand I agree this needs larger attention than it is receiving. The children who are the future cannot be oppressed for their ideas. ",7,t3_94rfy3,0,1533516860.0
Facebook has been removing your posts quite frequently now. Is there any other social media which is widespread in Bangladesh? Twitter?,10,t3_94rfy3,0,1533485724.0
Washington post has reported on this hopefully it will be picked up by NBC nightly news. I know that reaches a lot of people,6,t3_94rfy3,0,1533510883.0
Wrote european politician I worked for during my internship...Asked him What EU plans to do And What He himself can do to help...Not Sure If anyone did it already But I will update when I get his response.,6,t3_94rfy3,0,1533514422.0
I just joined the discord and they seem to think we are all trolls,8,t3_94rfy3,0,1533482786.0
As a Bengali living in Kolkata. Is there anyway I can help my brethren on the other side of the border ??,8,t3_94rfy3,0,1533487745.0
/r/askreddit sent me,9,t3_94rfy3,0,1533485528.0
I've wandered in here fron /r/all. Would someone mind giving a quick rundown for someone from the US?,8,t3_94rfy3,0,1533490332.0
"I have a server with unlimited bandwidth (gig connection), is there a compilation somewhere of stuff that needs to be mirrored?  Preferably something I can just wget in one shot if it gets updated often so I can script it.   I have a few things at [this link](https://www.uovalor.com/misc/bangladesh-2018/farmingbasics.html) but if there is something more comprehensive, perhaps a write up explaining what's going on, I'm willing to mirror it. 

My server is in Canada so probably less likely to be ordered by law to remove etc.  ",7,t3_94rfy3,0,1533504158.0
"If you have an iOS device and need encryption to communicate download the app called ""Invisible ink"" it will encrypt all text ",4,t3_94rfy3,0,1533498969.0
"Resist bot (https://resist.bot) makes it really easy for people in the US to message their Congress people and Governor about issues. 

I would suggest using the text from the whitehouse.org petition as a message. ",4,t3_94rfy3,0,1533514394.0
[Change.org](https://Change.org) has banned access from bangladesh .,5,t3_94rfy3,0,1533523553.0
"I live in the U.S is there anyway other than spread the message? Like send money?  it’s so unfair what’s going on and I want to help as much as I can, as a teenager this is terrible and I will spread the message as much as I can and I want to do as much as I possibly can to help.",10,t3_94rfy3,0,1533487212.0
Has anyone made a list of how to get a VPN?,3,t3_94rfy3,0,1533498177.0
"Also, when your government paves a legal way to shut down 'fake news' and  shut down the internet in times of trouble, think about the ramifications of the power that would grant them in a situation like this.

I'm not suggesting there is no fake news, but it should be easy for the average person to look at the source and make a judgement rather than granting their government the power to pull the curtains whenever they wish.",3,t3_94rfy3,0,1533517566.0
What is a vpn and why do I need it?,3,t3_94rfy3,0,1533517634.0
American here. I'm so sorry this is happening. Doing my best to get the word out.,3,t3_94rfy3,0,1533521242.0
"Would a boycott help?  A large portion of retail clothing vendors have clothing made in Bangladesh.  What if we set up petitions and organize boycotts if retailers that sell clothes made in Bangladesh?

I’m not sure how effective this would be, but for sure money talks louder in places like that. (Or financial hits rather)",3,t3_94rfy3,0,1533527899.0
"#PLEASE HELP US BY SPREADING THE WORD. YOU CAN TWEET THESE PRE-WRITTEN TEMPLATES: 

1.
>Bangladesh: Govt goons attack protesting students, gouging eyes, raping girls as young as 13,& destroying journalist equipment. Media blackout&internet speeds throttled to 2G to prevent sharing pic/vid . https://www.reddit.com/live/11e4mknpbhjqr/  We MUST #RebootBangladesh


2.
> The students in #Bangladesh are asking for #saferroads. Why is the government attacking them mercilessly? We demand Justice, we demand a better Bangladesh #RebootBangladesh


3.
> What started out as a #PeacefulProtest for #SaferRoads has turned into a nightmare for the students of #Bangladesh. The government is sending goons to attack the students and disrupt their protests which has led to a lot do injuries, death and rape. #RebootBangladesh


4.
> Students in Bangladesh are protesting for safer roads after the death of two students on the road. They're getting attacked, killed and raped by government goons. More information can be found on here, where information is uploaded live https://www.reddit.com/live/11e4mknpbhjqr/ #RebootBangladesh



You can also add your own version of it, but please include **#RebootBangladesh**


You can tweet these to your local media stations, reporters, journalists and literally anyone else. 

**BBC**
Justin Rowlatt -- South Asia Correspondent -- @BBCJustinR

Lyse Doucet    Chief international correspondent -- @bbclysedoucet

Sanjoy Majumder    India/South Asia correspondent  --  @BBCSanjoyM

Mahfuz Sadique    BBC News/ex Bangladesh correspondent      --  @MahfuzSadique


**CNN**
Anna Coren    International correspondent  --  @amcoren

Hande Atay Alam    International correspondent  --  @HandeAtayAlam

Karen Smith    Senior International Desk Editor  --  @KarenCNN


If you have the handles for other reporters, please update me. 
",3,t3_94rfy3,0,1533556019.0
"Hey, a Vietnamese guy who studies abroad in the UK here.

Currently in Saigon atm, was heartbroken when I saw these news. For what it’s worth, there’s two articles on Vietnam’s most popular digital newspaper about your plight already- [this one](https://vnexpress.net/tin-tuc/the-gioi/nguoi-bangladesh-bieu-tinh-8-ngay-vi-xe-buyt-dam-chet-hai-thieu-nien-3787905.html) regarding the ongoing protest, and [this more recent one](https://vnexpress.net/tin-tuc/the-gioi/doan-xe-cua-dai-su-my-o-bangladesh-bi-nhom-vu-trang-tan-cong-3788070.html?utm_source=search_vne) regarding how those government-hired thugs attacked the US ambassador.

I have liked these articles on the website to bring them a little closer to the frontpage, plus on Facebook also, and shared them on Twitter with the #RebootBangladesh hashtag. 

I still feel upset knowing that, due to my location and insignificance of my country, Vietnam, that I cannot help you more, but I truly hope every little bit counts. I have told my parents about this also. Just wished I could do more...",3,t3_94rfy3,0,1533575861.0
[deleted],7,t3_94rfy3,0,1533486196.0
Can someone explain what is going out there? I'm lost.,6,t3_94rfy3,0,1533489789.0
I got banned when a troll said millions of woman and children should be slaughtered if they protest more. What the fuck did I do? Lmao. The troll only got a 30 minute mute for that. ,5,t3_94rfy3,0,1533491006.0
"Contact news channels to make sure they are reporting on this.

http://cnnpressroom.blogs.cnn.com/press-contacts/

https://www.bbc.co.uk/mediacentre/contacts/press-office

http://press.foxnews.com",5,t3_94rfy3,0,1533507289.0
"PIA (Private Internet Access) is another great choice for a VPN, it's also quite cheap.",2,t3_94rfy3,0,1533515284.0
"Free vpn apps available on apple App Store:
X-vpn
VPN proxy betternet
VPN- upper unlimited proxy 
Hotspotshield vpn
Shield vpn

There are more, just search for “vpn”",2,t3_94rfy3,0,1533516932.0
I’ve been tweeting this link to every celebrity I follow on Twitter.  ,2,t3_94rfy3,0,1533517957.0
I have a YouTube channel that doesn’t have many subscribers but if you think it would help I could post a video to help spread awareness on other social platforms I haven’t seen much talk about this apart from reddit let me know guys thanks!,2,t3_94rfy3,0,1533520276.0
"Internationally there are several cities/countries that have a “sister city” relationship with cities in Bangladesh. Quite a few are in the U.K.

Can people draw on that relationship somehow? I don’t know how, though. But that relationship seems like it gives a reason for the foreign-local education ministers etc being pressured to learn more and care. 

http://en.sistercity.info/countries/bd.html",2,t3_94rfy3,0,1533521056.0
Anyway I can purchase VPN subscriptions to gift to people? ,2,t3_94rfy3,0,1533527772.0
I personally know an international reporter that works at NPR and ive told her directly about it and asked of she was able to at least get the story out.,2,t3_94rfy3,0,1533553249.0
"Pro government shills/bots are using the same hashtags with this

    ""A non political movement demanding #SafeRoadsForAll, demonstrated by school kids in #Bangladesh, supported by
    #SheikhHasina govt was exploited by #BNPJamaat to fulfill their evil dream to topple govt!
    #WeWantJustice
    @Reuters @DailyMirror @STcom @ChannelNewsAsia @AP""

They are copy pasting this verbatim across numerous accounts,",2,t3_94rfy3,0,1533560865.0
"For what it's worth, i've been on omegle for a little while asking if people have heard about what's going on in Bangladesh in an attempt to spread the word and create more awareness.",2,t3_94rfy3,0,1533566167.0
[deleted],2,t3_94rfy3,0,1533592983.0
"Hey, I recently tweeted about everything happening in Bangladesh b/c I saw it on reddit but saw it nowhere on twitter. It got a lot of attraction and I hope to do more with my platform like possibly set up a go fund me. Would love some advice on the best way to get this set up and to make sure it goes to the right place. Or if there are other means of helping, please let me know! I want to help in anyway possible. ",2,t3_94rfy3,0,1533613174.0
The Discord invite expired.,3,t3_94rfy3,0,1533485391.0
My friend read aloud a meme related to this event and didn't know what was happening. So now we've got memes.,3,t3_94rfy3,0,1533505880.0
"Right now the white house petition to condemn these acts officially only has less than 250 signatures... The link is in the post above.

Seriously... To those of us in the United States we can do better than this... We ended up with over 100k signatures on a petition to deport Justin Bieber... And the white house was actually forced to respond... Lets get them to respond to this",5,t3_94rfy3,0,1533505939.0
"BCL is their antifa. Just there to incite violence, oppress speech they don't like, and attack peaceful protesters. ",6,t3_94rfy3,0,1533496542.0
"Anyone like me living in the EU, contact your countries parliament, or EU presidents team itself president.juncker@ec.europa.eu

Please bring attention to this.
Students and children are the future of this planet, and we need to help them, not ignore them. ",1,t3_94rfy3,0,1533515340.0
"I am an editor, I can help with that.",1,t3_94rfy3,0,1533518024.0
These protest are being reported on lots of online news sites,1,t3_94rfy3,0,1533518194.0
"I've shared on as many outlets as I possibly could. Blasting US news outlets on twitter. 

I'll be sending letters to all of my state senators tomorrow on behalf of myself and some friends.

I hope this ends with a favorable outcome, and quickly. 

Godspeed.",1,t3_94rfy3,0,1533528581.0
"Pakistani here living in the U.S, is there anything i can do? Any gofundme page?",1,t3_94rfy3,0,1533529665.0
[deleted],1,t3_94rfy3,0,1533531935.0
I have people on Instagram sendine pictures and sending their thanks. I was wondering what I can do with them and how I can properly save them and protect the brave humans that are getting ahold of me. ,1,t3_94rfy3,0,1533534480.0
Let's get this to the front page of reddit and then expose it to the rest of the world. ,1,t3_94rfy3,0,1533534740.0
"I've created a privacy hotline where upon joining a Telegram channel or messaging a WhatsApp number, you get instructions on downloading Briar and Orbot/Onion Browser. [Details here.](https://www.reddit.com/r/bangladesh/comments/94ynup/the_privacy_hotline_is_up_simply_whatsapp_1/)",1,t3_94rfy3,0,1533534924.0
"I have relatives in Kolkata - is there anything I could ask them to do to help?

God I wish I had learned Bangla :/",1,t3_94rfy3,0,1533535634.0
"Canadian here with no personal connections to Bangladesh whatsoever. I haven't seen much coverage of this on news stations here.  Would it potentially help to pester media to cover this, or should I focus on contacting politicians?",1,t3_94rfy3,0,1533537176.0
"Maybe this will help: BBC is asking for information about the protests. This is their message:

Are you at the protests? If it safe to do so, please share your experience by emailing haveyoursay@bbc.co.uk.

Please include a contact number if you are willing to speak to a BBC journalist. You can also contact us in the following ways:

WhatsApp: +44 7555 173285Or Upload your pictures/video here
Tweet: @BBC_HaveYourSay
Send an SMS or MMS to 61124 (UK) or +44 7624 800 100 (international)
Please read our terms & conditions and privacy policy

Hope you all are safe!",1,t3_94rfy3,0,1533539163.0
"I wish there was an easy way to send the student's schools some umbrellas, mesh network stuff, shielding material, clothing, cheap phones, cheap cameras, etc. Anything they might need to be better schools as well.",1,t3_94rfy3,0,1533539623.0
Have the Jahangirnagar University (JU) students joined the protest today?,1,t3_94rfy3,0,1533543625.0
Can someone confirm that  #WeDemandJustice is active and the one in use? I've heard that it's being censored as well and wanted to confirm. ,1,t3_94rfy3,0,1533547870.0
"If anyone is bored can they please join me in spreading the new tag on Twitter? The tag is mostly me at the moment hahahah... 

Please seriously it’s just me using it right now",1,t3_94rfy3,0,1533549409.0
"This breaks my heart. I've already done my best to spread the word, but I wish there was more I could do.",1,t3_94rfy3,0,1533552222.0
"Anyone in Europe tweeted/ written to European council/ parliament? What do I say? What action can I demand that they take? 

I am horrified by this violence and want to help as much as I can",1,t3_94rfy3,0,1533554197.0
"For Canadian residents. If you want to get in touch with your MP and the PM use this site. All the necessary info is there. Just use your postal code/navigate the site.

http://www.ourcommons.ca/Parliamentarians/en/members",1,t3_94rfy3,0,1533554564.0
"Support Amnesty International, financially if you can, in other ways if you can't. They can get on the ground and do robust research & interviews, hold corrupt governments and officials to account and produce independent reports that can be used in international courts to evidence human rights abuses and breach of international law. This kind of situation is precisely why that organisation exists.

",1,t3_94rfy3,0,1533560832.0
The petition at [Change.org](https://www.change.org/p/united-nations-we-want-justice-human-rights-violence-happened-in-bangladesh) signed and shared.,1,t3_94rfy3,0,1533564144.0
"Possible improvement on the OP: Find a human rights organization that allows people to donate specifically to human rights violations in Bangladesh, and add a link to the OP.

I checked several human rights organizations, but none seems to allow to donate for violations in a specific country only.",1,t3_94rfy3,0,1533569280.0
